Band,Album,Genres,Score
Abraham,Débris de mondes perdus Review,"Doom Metal, Post-Hardcore, Post-Metal, Sludge Metal",3.5
Crowbar,Zero and Below Review,"Doom Metal, Sludge",3.5
Mountaineer,Giving Up the Ghost Review,"Doom Metal, Post-Metal, Shoegaze",3.5
Non Est Deus,Impious Review,Black Metal,3.5
Venator,Echoes From the Gutter Review,"Heavy Metal, NWOBHM",3.5
Ezkaton,To Those Who Fell Review,Black Metal,3.5
Shape of Despair,Return to the Void Review,"Death Metal, Funeral Doom",3.5
Tersivel,To the Orphic Void Review,"Death Metal, Progressive Metal, Symphonic Metal",3.5
Schizophrenia,Recollections of the Insane Review,"Death Metal, Thrash Metal",3.5
Bloodywood,Rakshak Review,"Deathcore, Folk Metal, Groove Metal, Melodic Metal, Nu Metal",3.5
An Isolated Mind,A Place We Cannot Go Review and Album Premiere,"Not Metal, Progressive Rock",3.5
Venom Prison,Erebos Review,"Death Metal, Hardcore, Melodic Death Metal",3.5
Author & Punisher,Krüller Review,"Doom Metal, Drone, Industrial Metal",3.5
Sarcasm,Stellar Stream Obscured Review,"Black Metal, Melodic Death Metal",3.5
Mass Worship,Portal Tombs Review,"Black Metal, Death Metal, Grind, Sludge Metal",3.5
Saxon,Carpe Diem Review,"Heavy Metal, NWOBHM",3.5
Maule,Maule Review,"Heavy Metal, NWOBHM",3.5
Krallice,Crystalline Exhaustion Review,Black Metal,3.5
Dawn of Solace,Flames of Perdition Review,"Doom Metal, Gothic Metal",3.5
Celeste,Assassine(s) Review,"Black Metal, Doom Metal, Hardcore, Post-Hardcore, Post-Metal, Sludge Metal",3.5
Burned in Effigy,Rex Mortem Review,"Death Metal, Melodic Death Metal",3.5
Lastera,From the Ashes Review,"Power Metal, Symphonic Metal",3.5
Toundra,Hex Review,Post-Metal,3.5
Mizmor,Wit’s End Review,"Black Metal, Doom Metal, Drone",3.5
Necrophagous,In Chaos Ascend Review,Death Metal,3.5
Wombbath,Agma Review,Death Metal,3.5
Imperialist,Zenith Review,Black Metal,3.5
Lhaäd,Below Review,Atmospheric Black Metal,3.5
Dessiderium,Aria Review,"Blackened Death Metal, Technical Death Metal",3.5
Redemptor,Agonia Review,"Death Metal, Technical Death Metal",3.5
Malady,Ainavihantaa Review,Progressive Rock,3.5
Heiress,Distant Fires Review,"Post-Hardcore, Sludge",3.5
Hunters Moon,The Great Pandemonium Review,Black Metal,3.5
Negură Bunget,Zău Review,"Black Metal, Folk Metal, Progressive Metal",3.5
Eternity’s End,Embers of War Review,"Heavy Metal, Power Metal, Speed Metal",3.5
1000 Bone Cylinder Explosion,Bind Review,"Black Metal, Power Metal, Progressive Metal, Thrash Metal",3.5
Vertebra Atlantis,Lustral Purge in Cerulean Bliss,"Atmospheric Black Metal, Black Metal, Death Metal",3.5
Aephanemer,A Dream of Wilderness Review,Melodic Death Metal,3.5
Daxma,Unmarked Boxes Review,"Ambient Metal, Post-Metal",3.5
Apostle of Solitude,When the Darkness Goes Review,Doom Metal,3.5
W.E.B.,Colosseum Review,"Black Metal, Blackened Death Metal, Death Metal, Symphonic Metal",3.5
Emma Ruth Rundle,Engine of Hell Review,"Ambient, Non-metal Metal Things",3.5
Waking the Cadaver,Authority Through Intimidation Review,"Death Metal, Hardcore, Slam",3.5
Massacre,Resurgence Review,Death Metal,3.5
Kolossus,K Review,Black Metal,3.5
Conjureth,Majestic Dissolve Review,Death Metal,3.5
Osukaru,Starbound Review,"Glam Metal, Hard Rock",3.5
Feral Season,Rotting Body in the Range of Light Review,Black Metal,3.5
Trivium,In the Court of the Dragon Review,"Heavy Metal, Metalcore",3.5
Teramaze,And the Beauty They Perceive Review,Progressive Metal,3.5
NecroticGoreBeast,Human Deviance Galore Review,"Death Metal, Slam",3.5
The Answer Lies in the Black Void,Forlorn Review,Doom Metal,3.5
Unto Others,Strength Review,,3.5
Driving Slow Motion,Adrift:Abyss Review,"Drone, Post-Metal",3.5
Skepticism,Companion Review,,3.5
Fustilarian,All This Promiscuous Decadence Review,Black Metal,3.5
Without God,Siberian Tunes: Purple Clouds Review,"Doom Metal, Sludge Metal, Stoner Metal",3.5
Carcass,Torn Arteries Review,Death Metal,3.5
Blazon Stone,Damnation Review,Heavy Metal,3.5
Dawn Fades,Ode Review,"Post-Metal, Shoegaze",3.5
Black Mass,Feast at the Forbidden Tree Review,"Speed Metal, Thrash Metal",3.5
Pa Vesh En,Maniac Manifest Review,"Black Metal, Doom Metal",3.5
Doctor Smoke,Dreamers and the Dead Review,"Hard Rock, Occult Rock, Stoner Rock",3.5
Rise to the Sky,Per Aspera Ad Astra Review,,3.5
Antediluvian,The Divine Punishment Review,"Black Metal, Death Metal",3.5
Sermon of Flames,"I Have Seen the Light, and It Was Repulsive Review","Black Metal, Death Metal, Electronic Metal, Industrial Metal, Noise",3.5
Portrait,At One with None Review,Heavy Metal,3.5
Oxygen Destroyer,Sinister Monstrosities Spawned by the Unfathomable Ignorance of Humankind Review,"Death Metal, Thrash Metal",3.5
Hooded Menace,The Tritonus Bell Review,"Death Metal, Doom Metal",3.5
Sun of the Suns,TIIT Review,"Death Metal, Progressive Metal",3.5
Our Place of Worship Is Silence,"Disavowed, and Left Hopeless Review","Black Metal, Hardcore, Sludge",3.5
Arcane Existence,Colossus Review,"Black Metal, Death Metal, Symphonic Metal",3.5
Witchcryer,When Their Gods Come for You Review,"Doom Metal, Occult Rock",3.5
Bonehunter,Dark Blood Reincarnation System Review,,3.5
Wolves in the Throne Room,Primordial Arcana Review,Black Metal,3.5
Vaelmyst,Secrypts of the Egochasm Review,Heavy Metal,3.5
Ænigmatum,Deconsecrate Review,"Blackened Death Metal, Death Metal",3.5
Unreqvited,Beautiful Ghosts Review,Ambient Metal,3.5
King Woman,Celestial Blues Review,"Doom Metal, Post-Metal, Sludge",3.5
Eastern High,Halo Review,"Gothic Metal, Metalcore, Progressive Metal",3.5
Praise the Plague,The Obsidian Gate Review,"Black Metal, Doom Metal, Sludge",3.5
Mama Doom,Ash Bone Skin N Stone Review,"Doom Metal, Heavy Metal, Occult Rock",3.5
Vouna,Atropos Review,"Atmospheric Black Metal, Black Metal, Doom Metal, Dungeon Synth",3.5
Lower Automation,Lower Automation Review,"Hardcore, Mathcore, Noise, Noise Rock, Punk",3.5
Vandor,On a Moonlit Night Review,Power Metal,3.5
Crescent,Carving the Fires of Akhet Review,"Black Metal, Death Metal",3.5
Qrixkuor,Poison Palinopsia,Death Metal,3.5
Burning Darkness,Dödens Makt Review,"Death Metal, Heavy Metal, Melodic Black Metal",3.5
Bizarrekult,Vi Overlevde Review,Black Metal,3.5
Hellish Form,Remains Review,"Doom Metal, Drone, Funeral Doom, Noise, Sludge",3.5
Stress Angel,Bursting Church Review,Death Metal,3.5
Drawn and Quartered,Congregation Pestilence Review,Death Metal,3.5
Suidakra,Wolfbite Review,"Folk Metal, Melodic Death Metal",3.5
The Absence,Coffinized Review,"Melodic Death Metal, Thrash Metal",3.5
Pharaoh,The Powers That Be Review,Heavy Metal,3.5
Helloween,Helloween Review,Power Metal,3.5
Starlight Ritual,Sealed in Starlight Review,Heavy Metal,3.5
Inhuman Condition,Rat°God Review,Death Metal,3.5
Black Moon Mother,Illusions Under the Sun Review,"Doom Metal, Shoegaze",3.5
Hannes Grossmann,To Where the Light Retreats Review,"Death Metal, Progressive Metal, Technical Death Metal",3.5
Portal,Hagbulbia Review,"Death Metal, Noise",3.5
Perturbator,Lustful Sacraments Review,Synthwave,3.5
Svneatr,Chinook Review,Black Metal,3.5
Cross Vault,As Strangers We Depart Review,Doom Metal,3.5
Bloodbound,Creatures of the Dark Realm Review,Power Metal,3.5
Acausal Intrusion,Nulitas Review,"Ambient Metal, Death Metal, Technical Death Metal",3.5
Disparaître,Urchig Review,,3.5
Inferno,Paradeigma (Phosphenes of Aphotic Eternity) Review,Black Metal,3.5
Domkraft,Seeds Review,"Doom Metal, Sludge Metal",3.5
The Plague,Within Death Review,"Death Metal, Hardcore",3.5
Hanternoz,Au Fleuve de Loire Review,Black Metal,3.5
Artillery,X Review,Thrash Metal,3.5
Stone Healer,Conquistador Review,"Black Metal, Progressive Metal, Stoner Metal",3.5
Fyrnask,VII-Kenoma Review,"Atmospheric Black Metal, Black Metal",3.5
Bloody Hell,The Bloodening Review,Heavy Metal,3.5
Helslave,From the Sulphur Depths Review,Death Metal,3.5
Ophiuchi,Shibboleth Review,"Black Metal, Doom Metal",3.5
Oryx,Lamenting a Dead World Review,"Doom Metal, Sludge",3.5
Desolate Realm,Desolate Realm Review,Doom Metal,3.5
Crypts of Despair,All Light Swallowed Review,"Black Metal, Blackened Death Metal, Death Metal",3.5
Bewitcher,Cursed Be Thy Kingdom Review,"Black Metal, Hard Rock, Heavy Metal, Speed Metal",3.5
Liquid Tension Experiment,LTE3 Review,"Instrumental Metal, Progressive Metal",3.5
Devil Sold His Soul,Loss Review,"Ambient Metal, Emo, Metalcore, Post-Hardcore, Post-Metal",3.5
Zao,The Crimson Corridor Review,"Metalcore, Post-Metal, Sludge",3.5
Wheel,Preserved in Time Review,Doom Metal,3.5
Los Disidentes Del Sucio Motel,Polaris Review,"Alternative Metal, Post-Metal, Progressive Metal, Progressive Rock, Stoner Rock",3.5
Avaland,Theater of Sorcery Review,"Power Metal, Symphonic Metal",3.5
Wheel,Resident Human Review,Progressive Metal,3.5
Unflesh,Inhumation Review,"Blackened Death Metal, Melodic Death Metal, Technical Death Metal",3.5
Decline of the I,Johannes Review,Black Metal,3.5
Witchseeker,Scene of the Wild Review,"Heavy Metal, Speed Metal",3.5
Celestial Sanctuary,Soul Diminished Review,Death Metal,3.5
Thermohaline,Maelström Review,"Black Metal, Death Metal, Folk Metal, Industrial Metal",3.5
Cambion,Conflagrate the Celestial Refugium Review,Death Metal,3.5
Thunder Horse,Chosen One Review,Doom Metal,3.5
Demiser,Through the Gate Eternal Review,"Black Metal, Thrash Metal",3.5
Eyehategod,A History of Nomadic Behavior Review,Sludge Metal,3.5
Orden Ogan,Final Days Review,Power Metal,3.5
Malist,Karst Relict Review,Atmospheric Black Metal,3.5
Summoning the Lich,United in Chaos Review,"Deathcore, Melodic Death Metal",3.5
Malice Divine,Malice Divine Review,"Black Metal, Blackened Death Metal, Death Metal, Melodic Death Metal",3.5
Thron,Pilgrim Review,Black Metal,3.5
Epica,Omega Review,"Power Metal, Progressive Metal, Symphonic Metal",3.5
The Generals,To Hell Review,"Death Metal, Hard Rock, Melodic Death Metal, Thrash Metal",3.5
Magoth,Invictus Review,Black Metal,3.5
Mastord,To Whom Bow Even the Trees Review,Progressive Metal,3.5
Ephemerald,Between the Glimpses of Hope Review,Melodic Death Metal,3.5
Gravesend,Methods of Human Disposal Review,,3.5
Coronary,Sinbad Review,Heavy Metal,3.5
Lake of Tears,Ominous Review,"Doom Metal, Gothic Metal, Progressive Metal",3.5
Alkerdeel,Slonk Review,,3.5
Narakah,Blast Haven Review,Grind,3.5
Everdawn,Cleopatra Review,Symphonic Metal,3.5
Crystal Viper,The Cult Review,Heavy Metal,3.5
Kjeld,Ôfstân Review,Black Metal,3.5
Omination,NGR (New Golgotha Repvbliq) Review,Funeral Doom,3.5
Harakiri for the Sky,Mære Review,"Black Metal, Melodic Black Metal, Post-Metal",3.5
Evil,Possessed by Evil Review,"Black Metal, Speed Metal",3.5
Mourners,Act I: Tragedies Review,Funeral Doom,3.5
Soen,Imperial CD Review,Progressive Metal,3.5
Yoth Iria,As The Flame Withers Review,Melodic Black Metal,3.5
Grima,Rotten Garden Review,Black Metal,3.5
Altered Dead,Returned to Life Review,"Death Doom, Death Metal",3.5
Ellende,Triebe Review,Black Metal,3.5
Asphyx,Necroceros Review,Death Metal,3.5
Need,Norchestrion: A Song for the End Review,Progressive Metal,3.5
Stellar Death,Fragments of Light Review,"Ambient Metal, Instrumental Metal, Post-Metal",3.5
Wombbath,Tales of Madness Review,Death Metal,3.5
Depravity,Grand Malevolence Review,Death Metal,3.5
Iron Mask,Master of Masters Review,Power Metal,3.5
Undergang,Aldrig i livet Review,Death Metal,3.5
Eleine,Dancing in Hell Review,Symphonic Metal,3.5
Dawnwalker,Ages Review,"Death Metal, Folk Metal, Post-Metal, Progressive Metal",3.5
Panychida,Gabreta Aeterna Review,Black Metal,3.5
Empress,Wait ‘Til Night Review,"Doom Metal, Post-Metal",3.5
Tombs,Under Sullen Skies Review,"Black Metal, Hardcore, Sludge",3.5
Soulburn,Noa’s D’ark Review,"Black Metal, Death Metal, Doom Metal",3.5
Eternal Champion,Ravening Iron Review,"Epic Metal, Heavy Metal",3.5
Megaton Sword,Blood Hails Steel – Steel Hails Fire Review,"Epic Metal, Heavy Metal",3.5
Countless Skies,Glow Review,"Melodic Death Metal, Progressive Metal",3.5
Decembre Noir,The Renaissance of Hope Review,"Death Metal, Doom Metal",3.5
Pyramaze,Epitaph Review,"Heavy Metal, Progressive Metal",3.5
Of Feather and Bone,Sulfuric Disintegration Review,Death Metal,3.5
Ezkaton/Solitude.m,Campfire of None [Split] Review,Black Metal,3.5
Sólstafir,Endless Twilight of Co-Dependent Love Review,Post-Metal,3.5
Ba’al,Ellipsism Review,"Black Metal, Post-Metal",3.5
Auðn,Vökudraumsins Fangi Review,"Atmospheric Black Metal, Black Metal",3.5
Stälker,Black Majik Terror Review,Speed Metal,3.5
Undeath,Lesions of a Different Kind Review,Death Metal,3.5
Celestial Season,The Secret Teachings Review,"Death Metal, Doom Metal",3.5
Mors Principium Est,Seven Review,Melodic Death Metal,3.5
Aphonic Threnody,The Great Hatred Review,"Death Metal, Doom Metal",3.5
Lord Almighty,Wither Review,Black Metal,3.5
Molassess,Through the Hollow Review,"Occult Rock, Psychedelic Rock",3.5
Wayfarer,A Romance with Violence Review,,3.5
Wreck-Defy,Powers That Be Review,Thrash Metal,3.5
Crippled Black Phoenix,Ellengæst Review,Progressive Rock,3.5
Gorephilia,In the Eye of Nothing Review,Death Metal,3.5
Onirik,The Fire Cult Beyond Eternity Review,Black Metal,3.5
Neànder,eremit Review,"Doom Metal, Post-Metal",3.5
Lik,Misanthropic Breed Review,Death Metal,3.5
Rise to the Sky,Death Will Not Keep Us Apart,Doom Metal,3.5
Empress,Premonition Review,"Post-Metal, Progressive Metal, Sludge",3.5
Sacred Outcry,Damned for All Time Review,Power Metal,3.5
Amiensus,Abreaction Review,,3.5
Skeletoon,Nemesis Review,Power Metal,3.5
B R I Q U E V I L L E,Quelle Review,"Instrumental Metal, Post-Metal",3.5
Second to Sun,Leviathan Review,"Black Metal, Death Metal",3.5
Vous Autres,Sel de Pierre Review,Black Metal,3.5
The Reticent,The Oubliette Review,Progressive Metal,3.5
Ayreon,Transitus Review,"Power Metal, Progressive Metal, Progressive Rock",3.5
Dynfari,Myrkurs er þörf Review,Post-Metal,3.5
Ambassador,Care Vale Review,"Hard Rock, Post-Metal",3.5
Memories of Old,The Zeramin Game Review,,3.5
Ragehammer,Into Certain Death Review,"Black Metal, Speed Metal",3.5
Finntroll,Vredesvävd Review,,3.5
Plague Years,Circle of Darkness Review,"Hardcore, Thrash Metal",3.5
Hræ,Þar sem skepnur reika Review,Black Metal,3.5
Skeletal Remains,The Entombment of Chaos Review,Death Metal,3.5
The Ocean,Phanerozoic II: Mesozoic | Cenozoic Review,"Post-Hardcore, Progressive Metal",3.5
Carnation,Where Death Lies Review,Death Metal,3.5
Theotoxin,Fragment: Erhabenheit Review,"Black Metal, Death Metal",3.5
Cult of Lilith,Mara,"Death Metal, Deathcore, Progressive Metal",3.5
Eave,Phantoms Made Permanent Review,,3.5
Thurisaz,Re-Incentive Review,Atmospheric Black Metal,3.5
Dunwich,Tail-Tied Hearts Review,"Doom Metal, Gothic Metal",3.5
Idolatria,Tetrabestiarchy Review,"Black Metal, Blackened Death Metal, Death Metal",3.5
Venomous Concept,Politics Versus the Erection Review,Grind,3.5
Duma,Duma Review,"Drone, Electronic, Electronic Metal, Experimental Metal, Grind, Non-metal Metal Things",3.5
Aleynmord,The Blinding Light Review,Black Metal,3.5
The Atomic Bitchwax,Scorpio Review,"Hard Rock, Stoner Metal",3.5
Almanac,"A Discographic Review [Tsar (2016), Kingslayer (2017) and Rush of Death (2020)]","Power Metal, Symphonic Metal, Thrash Metal",3.5
Wills Dissolve,Echoes Review and Album Premiere,"Death Metal, Progressive Metal",3.5
The Devil’s Trade,The Call of the Iron Peak,Folk,3.5
Unleash the Archers,Abyss Review,Power Metal,3.5
Bedsore,Hypnagogic Hallucinations Review,Death Metal,3.5
Prosanctus Inferi,Hypnotic Blood Art Review,"Black Metal, Death Metal",3.5
Self Hypnosis,Contagion of Despair Review,"Doom Metal, Stoner Metal",3.5
Siege Column,Darkside Legions Review,"Black Metal, Death Metal",3.5
Ov Shadows,I Djävulens Avbild Review,"Atmospheric Black Metal, Black Metal",3.5
Bear Mace,Charred Field of Slaughter Review,Death Metal,3.5
Bull Elephant,Created From Death Review,"Death Metal, Doom Metal, Progressive Metal",3.5
Nug,Alter Ego Review,Post-Metal,3.5
Black Crown Initiate,Violent Portraits of Doomed Escape Review,"Death Metal, Progressive Death, Progressive Metal",3.5
Rope Sect,The Great Flood Review,,3.5
Lantern,Dimensions Review,Death Metal,3.5
Judicator,Let There Be Nothing Review,"Power Metal, Progressive Metal",3.5
Damnation Angels,Fiber of Our Being Review,"Power Metal, Symphonic Metal",3.5
Dystopia A.D.,Rise of the Merciless Review,"Death Metal, Progressive Metal",3.5
Shezmu,À Travers Les Lambeaux Review,"Black Metal, Blackened Death Metal, Death Metal, Doom Metal",3.5
Drops of Heart,Stargazers Review,"Melodic Death Metal, Metalcore",3.5
Ahtme,Mephitic Review,Technical Death Metal,3.5
GOD,IV – Revelation Review,"Instrumental Metal, Progressive Metal, Technical Death Metal",3.5
Mystras,Castles Conquered and Reclaimed Review,"Black Metal, Folk",3.5
Lonely Robot,Feelings Are Good Review,"Non-metal Metal Things, Progressive Rock",3.5
Convocation,Ashes Coalesce Review,"Death Metal, Doom Metal",3.5
Serene Dark,Enantiodromia Review,"Black Metal, Death Metal",3.5
Devastator,Baptised in Blasphemy Review,"Black Metal, Speed Metal, Thrash Metal",3.5
Aseitas,False Peace Review,Death Metal,3.5
Rebel Wizard,Magickal Mystical Indifference Review,"Black Metal, Heavy Metal",3.5
Ensiferum,Thalassic Review,"Folk Metal, Melodic Death Metal",3.5
Kingnomad,Sagan Om Rymden Review,"Progressive Rock, Psychedelic Rock",3.5
Skeletal,Bitterness and Burning Hatred Review,Death Metal,3.5
DDENT,Couvre-sang Review,"Doom Metal, Instrumental Metal, Post-Metal, Sludge Metal",3.5
Northern Crown,In a Pallid Shadow Review and Album Premiere,"Doom Metal, Heavy Metal, Progressive Metal",3.5
Them Moose Rush,Dancing Maze Review,"Alt-Metal, Progressive Rock",3.5
Serment,"Chante, Ô Flamme de la Liberté Review","Black Metal, Melodic Black Metal",3.5
Threadbare,Silver Dollar Review,"Experimental Metal, Noise",3.5
Pyrrhon,Abscess Time Review,"Death Metal, Experimental Metal",3.5
The Third Kind,Man vs Earth Review,"Hardcore, Thrash Metal",3.5
Airbag,A Day at the Beach Review,Progressive Rock,3.5
Vile Creature,"Glory, Glory! Apathy Took Helm! Review","Black Metal, Doom Metal, Drone",3.5
Operus,Score of Nightmares Review,Symphonic Metal,3.5
Vampire,Rex Review,"Death Metal, Thrash Metal",3.5
Firelink,Firelink Review,"Black Metal, Melodic Black Metal",3.5
Cro-Mags,In the Beginning Review,,3.5
Greyhawk,Keepers of the Flame Review,Heavy Metal,3.5
Esoctrilihum,Eternity of Shaog Review,"Black Metal, Blackened Death Metal, Death Metal",3.5
Obscene,The Inhabitable Dark Review,Death Metal,3.5
Violent Hammer,Riders of the Wasteland Review,"Black Metal, Death Metal",3.5
The Committee,Utopian Deception Review,Black Metal,3.5
Naxen,Towards the Tomb of Times Review,"Atmospheric Black Metal, Black Metal, Doom Metal",3.5
Ormskrik,Ormskrik Review,"Black Metal, Thrash Metal",3.5
Sinister,Deformation of the Holy Realm Review,Death Metal,3.5
Zedi Forder,Isolation (and Zedi Forder Superium – Judgement) Review,"Alt-Metal, Heavy Metal, Progressive Metal",3.5
Pile of Priests,Pile of Priests Review,"Death Metal, Progressive Metal",3.5
Killitorous,The Afterparty Review,Technical Death Metal,3.5
Noctu,Gelidae Mortis Imago Review,"Doom Metal, Funeral Doom",3.5
Bear,Propaganda Review,"Groove Metal, Mathcore, Progressive Metal",3.5
Course of Fate,Mindweaver Review,Progressive Metal,3.5
Paradise Lost,Obsidian Review,Doom Metal,3.5
Firewind,Firewind Review,"Hard Rock, Heavy Metal, Power Metal",3.5
Naglfar,Cerecloth Review,"Black Metal, Melodic Black Metal",3.5
Forming The Void,Reverie Review,Doom Metal,3.5
Secrets of the Moon,Black House Review,Not Metal,3.5
Goden,Beyond Darkness Review,"Death Metal, Doom Metal, Sludge Metal",3.5
Witches Hammer,Damnation is My Salvation Review,Speed Metal,3.5
Witchskull,A Driftwood Cross Review,"Doom Metal, Heavy Metal, Stoner Metal",3.5
Dawn of Ouroboros,The Art of Morphology Review,Blackened Death Metal,3.5
Æther Realm,Redneck Vikings from Hell Review,Melodic Death Metal,3.5
Alkymist,Sanctuary Review,"Doom Metal, Progressive Metal, Sludge Metal",3.5
Shitfucker,Sex with Dead Body Review,"Black Metal, Punk, Thrash Metal",3.5
Blasphamagoatachrist,Bastardizing the Purity Review,"Black Metal, Death Metal",3.5
Venomous Skeleton,Drowning in Circles Review,"Black Metal, Blackened Death Metal, Death Metal, Doom Metal, Technical Death Metal",3.5
Traveler,Termination Shock Review,"Heavy Metal, NWOBHM, Speed Metal",3.5
Cirith Ungol,Forever Black Review,"Doom Metal, Heavy Metal",3.5
Ripped to Shreds,亂 (Luan) Review,Death Metal,3.5
Shards of Humanity,Cold Logic Review,Death Metal,3.5
Wayward Dawn,Haven of Lies Review,Death Metal,3.5
At the Altar of the Horned God,Through Doors of Moonlight Review,"Black Metal, Folk Metal",3.5
Khôra,Timaeus Review,"Blackened Death Metal, Progressive Metal",3.5
Symbolik,Emergence Review,"Symphonic Metal, Technical Death Metal",3.5
Myth of I,Myth of I Review,Progressive Metal,3.5
Live Burial,Unending Futility Review,Death Metal,3.5
Lord Vigo,Danse De Noir Review,"Doom Metal, Heavy Metal",3.5
Pure Reason Revolution,Eupnea Review,Progressive Rock,3.5
Skam,Sounds of a Disease Review,Death Metal,3.5
Grim Ravine,"It’s a Long Way Down, to Where You Are Review",Doom Metal,3.5
Graceless,Where Vultures Know Your Name Review,Death Metal,3.5
Wardaemonic,Acts of Repentance Review,"Black Metal, Blackened Death Metal",3.5
Amnutseba,Emanatism Review,"Black Metal, Melodic Death Metal",3.5
Lord Buffalo,Tohu Wa Bohu Review,"Folk, Not Metal",3.5
Sweven,The Eternal Resonance Review,"Death Metal, Progressive Metal",3.5
Fool’s Ghost,Dark Woven Light Review,,3.5
Soliloquium,Things We Leave Behind Review,"Doom Metal, Melodic Death Metal",3.5
White Stones,Kuarahy Review,"Death Metal, Progressive Metal",3.5
Viscera,Obsidian Review,Deathcore,3.5
Death the Leveller,II Review,Doom Metal,3.5
Spectral Lore and Mare Cognitum,Wanderers: Astrology of the Nine Review,"Atmospheric Black Metal, Black Metal",3.5
Vulcano,Eye in Hell Review,"Death Metal, Thrash Metal",3.5
Ambush,Infidel Review,Heavy Metal,3.5
Stonus,Aphasia Review,"Doom Metal, Stoner Metal, Stoner Rock",3.5
Dark Fortress,Spectres from the Old World Review,,3.5
Psychonaut,Unfold the God Man Review,Post-Metal,3.5
Mimorium,Blood of Qayin Review,Black Metal,3.5
Fluisteraars,Bloem Review,Atmospheric Black Metal,3.5
The Night Flight Orchestra,Aeromantic Review,Hard Rock,3.5
RED\\SHIFT,Grow.Decay.Transform. Review,"Metalcore, Sludge",3.5
Today is the Day,No Good to Anyone Review,"Grind, Noise, Sludge",3.5
Zifir,Demoniac Ethics Review,Black Metal,3.5
Slaughter Messiah,Cursed to the Pyre Review,Thrash Metal,3.5
Hex A.D.,Astro Tongue in the Electric Garden Review,"Doom Metal, Progressive Metal",3.5
Deliverance,Holocaust 26:1-46 Review,"Black Metal, Sludge Metal",3.5
Kause 4 Konflikt,Fornication Under Control of King Review,,3.5
Izthmi,The Arrows of Our Ways Review,"Black Metal, Post-Metal",3.5
Necrowretch,The Ones from Hell Review,"Blackened Death Metal, Death Metal",3.5
Psychotic Waltz,The God-Shaped Void Review,Progressive Metal,3.5
Frayle,1692 Review,"Doom Metal, Gothic Metal",3.5
Mitochondrial Sun,Mitochondrial Sun Review,"Electronic Metal, Electronica",3.5
Lorna Shore,Immortal Review,"Deathcore, Metalcore",3.5
Dead Kosmonaut,Gravitas Review,"Heavy Metal, Progressive Metal",3.5
Serpent Noir,Death Clan OD Review,Black Metal,3.5
Sepultura,Quadra Review,"Heavy Metal, Thrash Metal",3.5
Ironflame,Blood Red Victory Review,Heavy Metal,3.5
Crowhurst and Gavin Bryars,Incoherent American Narrative Review,"Ambient, Noise Metal",3.5
Leeched,To Dull the Blades of Your Abuse Review,"Hardcore, Industrial Metal",3.5
Bütcher,666 Goats Carry My Chariot Review,"Black Metal, Speed Metal",3.5
Deathwhite,Grave Image Review,"Doom Metal, Gothic Metal, Post-Metal",3.5
Jordablod,The Cabinet of Numinous Song Review,Black Metal,3.5
Sometimes We Make Music,Trail of The Fallen Review,Symphonic Metal,3.5
Thoughts Factory,Elements Review,"Progressive Metal, Progressive Rock",3.5
Ironsword,Servants of Steel Review,"Epic Metal, Heavy Metal",3.5
Midnight,Rebirth by Blasphemy Review,"Black Metal, Speed Metal, Thrash Metal",3.5
Vananidr,Damnation Review,Black Metal,3.5
Blessed Black,Beyond the Crimson Throne Review and Album Premiere,"Doom Metal, Epic Metal, Stoner Metal",3.5
Porta Nigra,Schöpfungswut Review,"Black Metal, Melodic Black Metal",3.5
Wormhole,The Weakest Among Us Review,"Slam, Technical Death Metal",3.5
Verthebral,Abysmal Decay Review,Death Metal,3.5
Catatonic Effigy,Putrid Tendency Review,"Death Metal, Drone, Experimental Metal, Noise, Post-Metal",3.5
Halphas,The Infernal Path into Oblivion Review,Black Metal,3.5
The River,Vessels into White Tides Review,"Doom Metal, Gothic Metal",3.5
Voltumna,Ciclope Review,"Black Metal, Blackened Death Metal, Death Metal",3.5
Perihelion,Agg Review,"Black Metal, Post-Metal",3.5
Hellsodomy,Morbid Cult Review,"Black Metal, Death Metal, Thrash Metal",3.5
Timeworn,Leave the Soul for Now Review,"Post-Metal, Progressive Metal, Sludge Metal",3.5
Horrizon,World of Pain Review,Melodic Death Metal,3.5
Reveal,Scissorgod Review,"Black Metal, Death Metal",3.5
Adrian Benegas,The Revenant Review,,3.5
Stormwarrior,Norsemen Review,"Power Metal, Speed Metal",3.5
Lord Mantis,Universal Death Church Review,"Black Metal, Noise, Sludge",3.5
Bednja,Doline Su Ostale Iza Nas Review,"Black Metal, Hardcore, Post-Metal",3.5
Bull Elephant,Bull Elephant Review,"Death Metal, Doom Metal, Progressive Metal, Sludge Metal, Thrash Metal",3.5
Remains,Chaos & Light Review,Death Metal,3.5
Blame Zeus,Seethe Review,"Alternative Metal, Hard Rock, Heavy Metal",3.5
Quayde LaHüe,Love out of Darkness Review,"Hard Rock, Heavy Metal",3.5
Warsenal,Feast Your Eyes Review,"Speed Metal, Thrash Metal",3.5
Via Vengeance,Diestractions from the Truth Review,"Doom Metal, Sludge Metal",3.5
Constellatia,The Language of Limbs Review,"Atmospheric Black Metal, Post-Metal",3.5
Hanging Garden,Into That Good Night Review,Doom Metal,3.5
Woodhawk,Violent Nature Review,Stoner Rock,3.5
We Lost the Sea,Triumph & Disaster Review,"Instrumental Metal, Post-Metal, Progressive Metal",3.5
Noveria,Aequilibrium Review,"Power Metal, Progressive Metal",3.5
