Band,Album,Genres,Score
Running Wild,Blood on Blood Review,Heavy Metal,3.0
Bizarre,Invocation Codex Review,Death Metal,3.0
Grand Cadaver,Into the Maw of Death Review,Death Metal,3.0
Burning Point,Arsonist of the Soul Review,"Heavy Metal, Power Metal",3.0
Order,The Gospel Review,Black Metal,3.0
Extreme Cold Winter,World Exit Review,"Death Metal, Doom Metal",3.0
Skeletoon,The 1.21 Gigawatts Club Review,Power Metal,3.0
Craneium,Unknown Heights Review,Stoner Rock,3.0
Crystal Coffin,The Starway Eternal Review,"Black Metal, Melodic Black Metal",3.0
Atræ Bilis,Apexapien Review,"Death Metal, Technical Death Metal",3.0
Kite,Currents Review,"Noise, Post-Hardcore, Sludge",3.0
Manimal,Armageddon Review,"Heavy Metal, Power Metal",3.0
Paydretz,Chroniques de l’Insurrection Review,"Black Metal, Folk Metal",3.0
Norse,Ascetic Review,Black Metal,3.0
Gràb,Zeitlang Review,Black Metal,3.0
Fear Connection,Progeny of a Social Disease Review,"Death Metal, Thrash Metal",3.0
Kryptos,Force of Danger Review,Heavy Metal,3.0
Ryghär,Thurmecia Eternal Review,"Epic Metal, Heavy Metal",3.0
Wraith,Undo the Chains Review,"Speed Metal, Thrash Metal",3.0
Hellsword,Cold Is the Grave Review,"Black Metal, Speed Metal, Thrash Metal",3.0
Kadabra,Ultra Review,"Psychedelic Rock, Stoner Rock",3.0
We Butter the Bread with Butter,Das Album Review,"Deathcore, Electronic Metal",3.0
Signs of the Swarm,Absolvere Review,Deathcore,3.0
Rivers of Nihil,The Work Review,"Death Metal, Progressive Metal",3.0
Tardus Mortem,Armageddon Review,"Blackened Death Metal, Death Metal",3.0
Starless,Hope Is Leaving You Review,Post-Metal,3.0
Mehenet,Ng’ambu Review,Black Metal,3.0
Ancient Empire,Priest of Stygia Review,Heavy Metal,3.0
Journey Into Darkness,Infinite Universe Infinite Death Review,"Black Metal, Death Metal, Symphonic Metal",3.0
Aborted,ManiaCult Review,Death Metal,3.0
Chrome Waves,The Rain will Cleanse Review,"Post-Metal, Shoegaze",3.0
Wharflurch,Psychedelic Realms ov Hell Review,"Death Metal, Doom Metal",3.0
TRNA,Istok Review,Black Metal,3.0
Nocturnal,Serpent Death Review,Thrash Metal,3.0
Malison,Death’s Embrace Review,"Heavy Metal, Power Metal, Thrash Metal",3.0
Book of Numbers,Magick Review,"Doom Metal, Heavy Metal, Power Metal",3.0
Nunslaughter,Red Is the Color of Ripping Death Review,"Death Metal, Thrash Metal",3.0
Thyrfing,Vanagandr Review,Viking Metal,3.0
Fluisteraars,Gegrepen door de geest der zielsontluiking Review,,3.0
Wormwitch,Wolf Hex Review,"Black Metal, Melodic Black Metal",3.0
Hooded Menace,The Tritonus Bell Review,"Death Metal, Doom Metal",3.0
The Slow Death,Siege Review,"Death Doom, Death Metal, Doom Metal, Funeral Doom",3.0
Gloop,Crayon Sun Review,"Blues, Noise Rock, post-punk, Punk",3.0
Malossi,Blanke Barter Review,Stoner Rock,3.0
Black Swamp Water,Awakening Review,"Hard Rock, Southern Metal",3.0
Killing,Face the Madness Review,Thrash Metal,3.0
Fleshbore,Embers Gathering Review,"Death Metal, Technical Death Metal",3.0
Prestige,Reveal the Ravage Review,Thrash Metal,3.0
Bohemyst,Čerň A Smrt Review,"Black Metal, Death Metal, Doom Metal, Melodic Black Metal",3.0
Alchemy of Flesh,Ageless Abominations Review,Death Metal,3.0
Rot Away,Nothing is Good Review,"Hardcore, Thrash Metal",3.0
Decrepisy,Emetic Communion Review,Death Metal,3.0
Dimman,Songs and Tales of Grievance Review,Melodic Death Metal,3.0
Netherbird,Arete Review,"Black Metal, Melodic Black Metal",3.0
Groza,The Redemptive End Review,"Atmospheric Black Metal, Black Metal, Melodic Black Metal",3.0
Amnessia Eterna,Malditos Review,Thrash Metal,3.0
Blacksword,Alive Again Review,Heavy Metal,3.0
Moon Reaper,Descent Review,"Black Metal, Blackened Death Metal, Deathcore, Doom Metal, Gothic Metal, Groove Metal, Metalcore",3.0
Expunged,Into Never Shall Review,Death Metal,3.0
Galvanizer,Prying Sight of Imperception Review,Death Metal,3.0
Lantlôs,Wildhund Review,"Alt-Metal, Post-Metal",3.0
Cognitive,Malevolent Thoughts of a Hastened Extinction Review,"Deathcore, Technical Death Metal",3.0
Death Tribe,Beyond the Red Light District: A Canal Experiment Review,"Death Metal, Doom Metal, Groove Metal",3.0
Hinsides,Under Betlehems brinnande stjärna Review,Black Metal,3.0
Elderblood,Achrony Review,"Black Metal, Blackened Death Metal",3.0
At The Gates,The Nightmare of Being Review,Death Metal,3.0
Felled,The Intimate Earth Review,"Atmospheric Black Metal, Black Metal, Folk Metal, Melodic Black Metal",3.0
Cerebral Rot,Excretion of Mortality Review,Death Metal,3.0
Neker,Slower Review,"Doom Metal, Sludge, Southern Metal",3.0
Cathexis,Untethered Abyss Review,Death Metal,3.0
Kollapse,Sult Review,"Hardcore, Post-Hardcore, Post-Metal",3.0
Thūn,Thūn Review,"Death Metal, Doom Metal",3.0
Eye of Purgatory,The Lighthouse Review,Melodic Death Metal,3.0
Ossaert,Pelgrimsoord Review,"Black Metal, Doom Metal",3.0
Passéisme,Eminence Review,Black Metal,3.0
Lucifer’s Hammer,The Trip Review,"Heavy Metal, NWOBHM",3.0
Flotsam and Jetsam,Blood in the Water Review,Thrash Metal,3.0
Grief Collector,En Delirium Review,Doom Metal,3.0
Desaster,Churches Without Saints Review,"Black Metal, Death Metal",3.0
The Vicious Head Society,Extinction Level Event Review,Progressive Metal,3.0
Noctule,Wretched Abyss Review,"Atmospheric Black Metal, Black Metal",3.0
Killing Addiction,Mind of a New God Review,Death Metal,3.0
Sectlinefor,Kissing Strangers During an Outbreak,"Alternative Metal, Electronica",3.0
Majestic Downfall,Aorta Review,"Death Metal, Doom Metal, Funeral Doom",3.0
Esoctrilihum,Dy’th Requiem for the Serpent Telepath Review,"Black Metal, Blackened Death Metal, Death Metal",3.0
Robots of the Ancient World,Mystic Goddess Review,Psychedelic Rock,3.0
Poverty’s No Crime,A Secret To Hide Review,Progressive Metal,3.0
Leach,Lovely Light of Life Review,"Groove Metal, Hardcore, Melodic Death Metal, Thrash Metal",3.0
An Autumn for Crippled Children,As The Morning Dawns We Close Our Eyes Review,Shoegaze,3.0
Anatomia,Corporeal Torment Review,Death Doom,3.0
Wreche,All my dreams came true Review,Black Metal,3.0
Siniestro,Vortexx Review,Thrash Metal,3.0
Cadaveric Incubator,Nightmare Necropolis Review,Death Metal,3.0
Voronoi,The Last Three Seconds Review,,3.0
Moon Coven,Slumber Wood Review,,3.0
Nightshadow,Strike Them Dead Review,"Heavy Metal, Power Metal, Speed Metal",3.0
Methadone Skies,Retrofuture Caveman Review,,3.0
Becerus,Homo Homini Brutus Review,Death Metal,3.0
Body Void,Bury Me Beneath this Rotting Earth Review,,3.0
Insane,Victims Review,"Speed Metal, Thrash Metal",3.0
The Circle,Metamorphosis Review,"Black Metal, Melodic Death Metal, Power Metal",3.0
Nattverd,Vandring Review,Black Metal,3.0
Vreid,Wild North West Review,Melodic Black Metal,3.0
Miasma Theory,Miasma Theory Review,"Doom Metal, Heavy Metal",3.0
Lucifuge,Infernal Power Review,"Black Metal, Speed Metal, Thrash Metal",3.0
Mister Misery,A Brighter Side of Death Review,"Melodic Metal, Thrash Metal",3.0
Nordgeist,Frostwinter Review,Atmospheric Black Metal,3.0
Neptunian Maximalism,Solar Drone Ceremony Review,"Ambient, Doom Metal, Punk",3.0
Arogya,Genesis Review,Heavy Metal,3.0
Spectral Lore,Ετερόφωτος Review,"Atmospheric Black Metal, Black Metal, Drone",3.0
Chain Gang Grave,Cement Mind Review,"Death Metal, Punk, Sludge Metal",3.0
Cannibal Corpse,Violence Unimagined Review,Death Metal,3.0
Syning,Syning Review,Black Metal,3.0
Horndal,Lake Drinker Review,"Death Metal, Hardcore, Sludge Metal",3.0
The Lion’s Daughter,Skin Show Review,"Industrial Metal, Sludge",3.0
The Limit,Caveman Logic Review,,3.0
Fuoco Fatuo,Obsidian Katabasis Review,"Death Metal, Doom Metal",3.0
Hiraki,Stumbling Through The Walls Review,"Noise Metal, Post-Metal, Punk",3.0
Evil Drive,Demons Within Review,Melodic Death Metal,3.0
The Quill,Earthrise Review,"Hard Rock, Heavy Metal",3.0
Grabak,Scion Review,"Black Metal, Doom Metal",3.0
Servants to the Tide,Servants to the Tide Review,Doom Metal,3.0
Byron,The Omega Evangelion Review,"Doom Metal, Epic Metal, Heavy Metal, NWOBHM",3.0
Ghosts of Atlantis,3.6.2.4 Review,"Progressive Metal, Symphonic Metal",3.0
Revenant Marquis,Below the Landsker Line Review,Black Metal,3.0
The Crown,Royal Destroyer Review,,3.0
Fuath,II Review,"Atmospheric Black Metal, Black Metal",3.0
Lunar Shadow,Wish to Leave Review,Heavy Metal,3.0
Rise to the Sky,Let Me Drown with You Review,Doom Metal,3.0
Reaper,The Atonality of Flesh Review,"Black Metal, Crust Punk, Speed Metal",3.0
Wolf King,The Path of Wrath Review,"Black Metal, Sludge",3.0
Butterfly,Doorways of Time Review,"Hard Rock, Heavy Metal",3.0
Wolvennest,Temple Review,"Black Metal, Doom Metal",3.0
Witherfall,Curse of Autumn Review,"Heavy Metal, Progressive Metal",3.0
Korpse,Insufferable Violence Review,Slam,3.0
Innersphere,Omfalos Review,"Death Metal, Doom Metal, Melodic Death Metal",3.0
Evergrey,Escape of the Phoenix Review,"Gothic Metal, Progressive Metal",3.0
Age of Woe,Envenom Review,Sludge,3.0
Humanity’s Last Breath,Välde Review,"Death Metal, Deathcore, Djent",3.0
Dark Zodiak,Ophiuchus Review,Thrash Metal,3.0
Crawl Below,9 Mile Square Review,Doom Metal,3.0
Insect Inside,The First Shining of New Genus Review,"Death Metal, Technical Death Metal",3.0
Swampbeast,Seven Evils Spawned of Seven Heads Review,Death Metal,3.0
Pestis Cultus,Pestis Cultus Review,Black Metal,3.0
Dead Exaltation,Despondent Review,"Death Metal, Progressive Metal, Technical Death Metal",3.0
DayGlo Mourning,Dead Star Review,"Doom Metal, Stoner Metal",3.0
Wizard,Metal in My Head Review,"Heavy Metal, Power Metal",3.0
Steven Wilson,The Future Bites Review,"Electronic, Progressive Rock",3.0
StarGazer,Psychic Secretions Review,"Black Metal, Death Metal",3.0
Sarin,You Can’t Go Back Review,"Post-Metal, Sludge Metal",3.0
Revulsion,Revulsion Review,Death Metal,3.0
Portrayal of Guilt,We Are Always Alone Review,Hardcore,3.0
Tribulation,Where the Gloom Becomes Sound Review,Gothic Metal,3.0
Endezzma,"The Archer, Fjord and the Thunder Review",Black Metal,3.0
Accept,Too Mean to Die Review,Heavy Metal,3.0
Nervosa,Perpetual Chaos Review,"Death Metal, Thrash Metal",3.0
Red Cain,Kindred: Act II Review,"Electronica Metal, Pop Metal, Power Metal",3.0
Holy Mother,Face This Burn Review,,3.0
Aethyrick,Apotheosis Review,Black Metal,3.0
Funeral Fullmoon,Revelation of Evil Review,Black Metal,3.0
Bloodletter,Funeral Hymns Review,"Death Metal, Melodic Death Metal, Thrash Metal",3.0
Malakhim,Theion Review,"Black Metal, Melodic Black Metal",3.0
Frozen Soul,Crypt of Ice Review,Death Metal,3.0
Old Growth,Mossweaver Review,Atmospheric Black Metal,3.0
Gjoad,Samanōn Review,,3.0
Genus Ordinis Dei,Glare of Deliverance Review,"Melodic Death Metal, Symphonic Metal",3.0
Our Oceans,While Time Disappears Review,Progressive Rock,3.0
Iron Savior,Skycrest Review,"Heavy Metal, Power Metal",3.0
Azarath,Saint Desecration Review,"Black Metal, Blackened Death Metal, Death Metal",3.0
Gama Bomb,Sea Savage Review,"Heavy Metal, Thrash Metal",3.0
Stormkeep,Galdrum Review,,3.0
Mongrel’s Cross,"Arcana, Scrying and Revelation Review","Black Metal, Thrash Metal",3.0
Contrarian,Only Time Will Tell Review,"Death Metal, Progressive Metal",3.0
Sodom,Genesis XIX Review,Thrash Metal,3.0
Communic,Hiding from the World Review,"Heavy Metal, Progressive Metal",3.0
Skelethal,Unveiling the Threshold Review,Death Metal,3.0
Death Dealer,Conquered Lands Review,"Heavy Metal, Power Metal",3.0
Harlott,Detritus of the Final Age Review,Thrash Metal,3.0
Mitochondrial Sun,Sju Pulsarer Review,"Black Metal, Electronica Metal",3.0
MRTVI,Omniscient Hallucinatory Delusion Review,Black Metal,3.0
Shattered Hope,Vespers Review,"Death Doom, Death Metal, Doom Metal",3.0
Kimono Drag Queens,Songs of Worship Review,"Psychedelic Rock, Rock",3.0
Demonical,World Domination Review,Death Metal,3.0
Draconian,Under a Godless Veil Review,"Death Metal, Doom Metal, Gothic Metal",3.0
Svabhavat,Black Mirror Reflection Review,"Black Metal, Doom Metal",3.0
Cynabare Urne,Obsidian Daggers and Cinnabar Skulls Review,Death Metal,3.0
Epitimia,Allusion Review,"Atmospheric Black Metal, Black Metal, Post-Metal",3.0
Prometheus,Resonant Echoes From Cosmos Of Old Review,"Atmospheric Black Metal, Black Metal, Death Metal",3.0
Invincible Force,Decomposed Sacramentum Review,"Death Metal, Thrash Metal",3.0
Goratory,Sour Grapes Review,"Death Metal, Grind",3.0
Spirit Adrift,Enlightened in Eternity Review,Heavy Metal,3.0
Neck Cemetery,Born in a Coffin Review,Heavy Metal,3.0
Invernoir,The Void and the Unbearable Loss Review,"Death Metal, Doom Metal",3.0
Yatra,All is Lost Review,"Doom Metal, Sludge, Stoner Metal",3.0
Helion Prime,Question Everything Review,Power Metal,3.0
Nightmare,Aeternam Review,"Hard Rock, Heavy Metal, Power Metal",3.0
Scordatura,Mass Failure Review,Death Metal,3.0
Monsterworks,Malignment Review,Progressive Metal,3.0
Brave the Cold,Scarcity Review,"Death Metal, Grind, Thrash Metal",3.0
Madrost,Charring the Rotting Earth Review,"Progressive Death, Thrash Metal",3.0
Hittman,Destroy All Humans Review,Heavy Metal,3.0
Uada,Djinn Review,Melodic Black Metal,3.0
Mindwars,The Fourth Turning Review,Thrash Metal,3.0
Infesticide,Envenoming Wounds Review,Death Metal,3.0
Just Before Dawn,An Army at Dawn Review,Death Metal,3.0
Proscription,Conduit Review,"Black Metal, Blackened Death Metal, Death Metal",3.0
Illkynja,Sæti Sálarinnar Review,"Atmospheric Black Metal, Black Metal",3.0
Napalm Death,Throes of Joy in the Jaws of Defeatism Review,"Death Metal, Grind",3.0
Fires in the Distance,Echoes from Deep November Review,Melodic Death Metal,3.0
Exist,Egoiista Review,Progressive Metal,3.0
Burial Remains,Spawn of Chaos Review,Death Metal,3.0
En Minor,When the Cold Truth Has Worn Its Miserable Welcome Out Review,Not Metal,3.0
Winter’s Verge,The Ballad of James Tig Review,Power Metal,3.0
Night,High Tides – Distant Skies Review,"Hard Rock, Retro Metal",3.0
Jupiterian,Protosapien Review,Sludge,3.0
Turtle Skull,Monoliths Review,"Doom Metal, Drone, Post-Metal, Progressive Rock, Psychedelic Rock, Stoner Rock",3.0
The Glorious Dead,Into Lifeless Shrines Review,Death Metal,3.0
Hymn,Breach Us Review,Sludge,3.0
Svederna,Härd Review,Black Metal,3.0
Begrafven,Dödsriket Review,Black Metal,3.0
Ulver,Flowers of Evil Review,Synthwave,3.0
Svnth,Spring In Blue Review,"Atmospheric Black Metal, Post-Metal",3.0
Pain of Salvation,Panther Review,Progressive Rock,3.0
Vanishing Point,Dead Elysium Review,Progressive Metal,3.0
Almanac,"A Discographic Review [Tsar (2016), Kingslayer (2017) and Rush of Death (2020)]","Power Metal, Symphonic Metal, Thrash Metal",3.0
Silver Knife,Unyielding/Unseeing Review,Black Metal,3.0
Incantation,Sect of Vile Divinities Review,Death Metal,3.0
Veonity,Sorrows Review,Power Metal,3.0
Mercyless,The Mother of All Plagues Review,Death Metal,3.0
Midgard,Tales of Kreia Review,"Folk Metal, Power Metal, Viking Metal",3.0
Next Life,Guru Meditation Review,"Chiptune, Grind, Industrial Metal, Mathcore",3.0
Recorruptor,The Funeral Corridor Review,Death Metal,3.0
Töxik Death,Sepulchral Demons Review,"Speed Metal, Thrash Metal",3.0
Awake by Design,Awake by Design Review,"Heavy Metal, Power Metal, Progressive Metal",3.0
Cancer,Opioid Review,Black Metal,3.0
Howling Giant / Sergeant Thunderhoof,Turned to Stone Chapter 2: Masamune & Muramasa Review,"Doom Metal, Stoner Metal, Stoner Rock",3.0
Texas Murder Crew,Everyone’s Last Breath Review,Death Metal,3.0
Onslaught,Generation Antichrist Review,"Groove Metal, Thrash Metal",3.0
High Spirits,Hard to Stop Review,"Heavy Metal, NWOBHM",3.0
Blackballed,Elephant in the Room Review,Hard Rock,3.0
Katalepsy,Terra Mortus Est Review,Death Metal,3.0
Deathstorm,For Dread Shall Reign Review,"Death Metal, Thrash Metal",3.0
Primal Fear,Metal Commando Review,Heavy Metal,3.0
Stonebirds,Collapse and Fail Review,"Post-Metal, Sludge, Stoner Rock",3.0
Valgrind,Condemnation Review,Death Metal,3.0
Catalysis,Connection Lost Review,"Death Metal, Groove Metal, Metalcore",3.0
Domination Black,Judgement IV Review,"Heavy Metal, Power Metal",3.0
Fides Inversa,Historia Nocturna Review,Black Metal,3.0
Temple of Dread,World Sacrifice Review,Death Metal,3.0
MIGHT,MIGHT Review,"Doom Metal, Sludge Metal",3.0
Guardian of Lightning,Cosmos Tree Review,Stoner Metal,3.0
Jet Jaguar,Endless Nights Review,"Glam Metal, Heavy Metal, NWOBHM",3.0
Väki,Kuolleen Maan Omaksi Review,Black Metal,3.0
Enshadowed,Stare into the Abyss Review,"Atmospheric Black Metal, Black Metal",3.0
Bell Witch/Aerial Ruin,Stygian Bough Volume I Review,Folk,3.0
Pessimist,Holdout Review,Thrash Metal,3.0
Pixie Ninja,Colours out of Space Review,"Ambient Metal, Electronica",3.0
Stygian Crown,Stygian Crown Review,Doom Metal,3.0
Vspolokh,Помре Review,"Atmospheric Black Metal, Black Metal",3.0
Aleah,Aleah Review,Not Metal,3.0
Mora Prokaza,By Chance Review,"Black Metal, Neo-Classical Metal, Rap Metal",3.0
Hornwood Fell,Cursed Thoughts – I II Review,"Black Metal, Death Metal",3.0
The Moon and the Nightspirit,Aether Review,"Folk, Not Metal",3.0
Creature,Ex Cathedra Review,Black Metal,3.0
Wino,Forever Gone Review,Folk,3.0
Irae,Lurking in the Depths Review,"Atmospheric Black Metal, Black Metal, Groove Metal, Melodic Black Metal",3.0
Aversio Humanitatis,Behold the Silent Dwellers Review,Black Metal,3.0
Lamb of God,Lamb of God Review,"Groove Metal, Thrash Metal",3.0
October Falls,A Fall of an Epoch Review,"Black Metal, Folk Metal",3.0
Anonymus,La Bestia Review,Thrash Metal,3.0
Nemesium,Continua Review,Death Metal,3.0
Mountaineer,Bloodletting Review,"Doom Metal, Post-Metal, Shoegaze, Sludge",3.0
Many Blessings,Emanation Body Review,Noise,3.0
Everlore,Everlore Review,Power Metal,3.0
Devil with No Name,Devil with No Name Review,Black Metal,3.0
Blight,Temple of Wounds Review,Black Metal,3.0
In the Company of Serpents,Lux Review,Doom Metal,3.0
Shadow in the Darkness,Erstwhile Befell Review,Technical Death Metal,3.0
ACxDC,Satan Is King Review,"Hardcore, Powerviolence",3.0
Mountain Witch,Extinct Cults Review,"Doom Metal, Hard Rock, Heavy Metal",3.0
Carach Angren,Franckensteina Strataemontanus Review,,3.0
Shok Paris,Full Metal Jacket Review,Heavy Metal,3.0
Eyeless in Gaza,Act I: The Protagonist Review,"Ambient Metal, Doom Metal",3.0
Sorcerer,Lamenting of the Innocent Review,"Doom Metal, Heavy Metal",3.0
Sodomisery,The Great Demise Review,"Black Metal, Death Metal, Melodic Black Metal",3.0
Horn,Mohngang Review,"Black Metal, Folk Metal",3.0
Zedi Forder,Isolation (and Zedi Forder Superium – Judgement) Review,"Alt-Metal, Heavy Metal, Progressive Metal",3.0
Ara,Jurisprudence Review,"Death Metal, Technical Death Metal",3.0
Wailin Storms,Rattle Review,,3.0
Gomorra,Divine Judgement Review,"Heavy Metal, Power Metal",3.0
Caligula’s Horse,Rise Radiant Review,"Progressive Metal, Progressive Rock",3.0
Theosophy,Towers of Dark Pantheon Review,Black Metal,3.0
Tyrant,Hereafter Review,"Doom Metal, Heavy Metal",3.0
Sinistral King,Serpent Uncoiling Review,Black Metal,3.0
Azath,Through a Warren of Shadow Review,Death Metal,3.0
Freddy and the Phantoms,A Universe from Nothing Review,Rock,3.0
The Alligator Wine,Demons of the Mind Review,,3.0
Ash Return,The Sharp Blade of Integrity Review,"Hardcore, Heavy Metal, Metalcore",3.0
Hegemony,Enthroned by Persecution Review,"Black Metal, Death Metal",3.0
Armnatt,Dense Fog Review,Black Metal,3.0
Head of the Demon,Deadly Black Doom Review,,3.0
Nyrst,Orsök Review,Black Metal,3.0
Bezwering,Aan De Wormen Overgeleverd Review,Black Metal,3.0
The Ditch and the Delta,The Ditch and the Delta Review,"Doom Metal, Progressive Metal, Sludge Metal",3.0
Blaze of Sorrow,Absentia Review,Black Metal,3.0
Bythos,The Womb of Zero Review,"Black Metal, Blackened Death Metal",3.0
Volturian,Crimson Review,"Electronica Metal, Gothic Metal, Melodic Metal",3.0
Turmion Kätilöt,Global Warning Review,Industrial Metal,3.0
Absolva,Side by Side Review,"Heavy Metal, NWOBHM",3.0
The Black Dahlia Murder,Verminous Review,Melodic Death Metal,3.0
Collision,The Final Kill Review,Hardcore,3.0
Nekrovault,Totenzug: Festering Peregrination Review,"Death Doom, Death Metal",3.0
Spell,Opulent Decay Review,Heavy Metal,3.0
HellgardeN,"Making Noise, Living Fast Review","Groove Metal, Thrash Metal",3.0
Azusa,Loop of Yesterdays Review,Hardcore,3.0
Beggar,Compelled to Repeat Review,"Sludge, Stoner Metal",3.0
Testament,Titans of Creation Review,Thrash Metal,3.0
Wvrm,Colony Collapse Review,,3.0
Demonic Death Judge,The Trail Review,"Folk, Groove Metal, Sludge Metal, Stoner Metal",3.0
Temple of Void,The World That Was Review,"Death Metal, Doom Metal",3.0
Perdition Temple,Sacraments of Descension Review,"Black Metal, Death Metal",3.0
Nite,Darkness Silence Mirror Flame Review,"Black Metal, Heavy Metal",3.0
Aodon,11069 Review,"Atmospheric Black Metal, Black Metal",3.0
No Raza,Transcending Material Sins Review,Death Metal,3.0
Tethra,Empire of the Void Review,,3.0
Master Boot Record,Floppy Disk Overdrive Review,"Doom Metal, Electronic Metal, Synthwave",3.0
Caskets Open,Concrete Realms of Pain Review,"Doom Metal, Hardcore",3.0
The Medea Project,Sisyphus Review,"Doom Metal, Gothic Metal, Sludge",3.0
Heaven Shall Burn,Of Truth & Sacrifice Review,Metalcore,3.0
Ruinas,Ikonoklasta Review,"Crust Punk, Death Metal",3.0
Saltas,Mors Salis: Opus I Review,"Black Metal, Death Metal, Doom Metal",3.0
Wombbath,Choirs of the Fallen Review,Death Metal,3.0
Solitary Sabred,By Fire & Brimstone Review,"Heavy Metal, Power Metal",3.0
Ruin Lust,Choir of Babel Review,"Black Metal, Blackened Death Metal, Death Metal",3.0
Faustian Pact,Outojen Tornien Varjoissa Review,"Atmospheric Black Metal, Black Metal, Folk Metal",3.0
Ross the Boss,Born of Fire Review,Heavy Metal,3.0
Dwaal,Gospel of the Vile Review,"Doom Metal, Post-Metal, Sludge",3.0
My Dying Bride,The Ghost of Orion Review,Doom Metal,3.0
Beast of Revelation,The Ancient Ritual of Death Review,"Death Doom, Death Metal, Doom Metal",3.0
Body Count,Carnivore Review,,3.0
Voidfire,Ogień Pustki Review,Black Metal,3.0
Regarde les Hommes Tomber,Ascension Review,"Black Metal, Sludge",3.0
Ensnared,Inimicus Generis Humani Review,Death Metal,3.0
Shadow Witch,Under the Shadow of a Witch Review,"Doom Metal, Stoner Rock",3.0
Seven Planets,Explorer Review,,3.0
Thoren,Gwarth II Review,"Death Metal, Experimental Metal, Instrumental Metal, Technical Death Metal",3.0
On Thorns I Lay,Threnos Review,"Doom Metal, Melodic Death Metal",3.0
Primeval Mass,Nine Altars Review,"Black Metal, Thrash Metal",3.0
Runescarred,The Distant Infinite Review,"Heavy Metal, Progressive Metal, Thrash Metal",3.0
Lucifuge,The One Great Curse Review,"Black Metal, Thrash Metal",3.0
Maere,I Review,Death Metal,3.0
Dzö-nga,Thunder in the Mountains Review,"Black Metal, Folk Metal",3.0
Miles to Perdition,2084 Review,"Melodic Death Metal, Metalcore",3.0
Serious Black,Suite 226 Review,Power Metal,3.0
Gorevent,Fate Review,Slam,3.0
Moloken,Unveilance of Dark Matter Review,"Death Doom, Doom Metal, Hardcore, Post-Metal, post-punk, Progressive Metal",3.0
Goblinsmoker,"A Throne In Haze, A World Ablaze Review","Doom Metal, Sludge",3.0
Coffin Curse,Ceased to Be Review,Death Metal,3.0
Grey Skies Fallen,Cold Dead Lands Review,"Death Metal, Doom Metal",3.0
Kirk Windstein,Dream in Motion Review,"Psychedelic Rock, Rock",3.0
Reaper,Unholy Nordic Noise Review,"Black Metal, Speed Metal",3.0
Impiety,Versus All Gods Review,"Black Metal, Death Metal",3.0
Rat King,Vicious Inhumanity Review,"Death Metal, Grind, Sludge Metal",3.0
Haunt,Mind Freeze Review,"Heavy Metal, NWOBHM",3.0
Mystic Prophecy,Metal Division Review,"Heavy Metal, Power Metal",3.0
War Dogs,Die By My Sword Review,"Epic Metal, Heavy Metal, NWOBHM",3.0
Israthoum,Arrows from Below Review,Black Metal,3.0
Oath of Cruelty,Summary Execution at Dawn Review,"Death Metal, Thrash Metal",3.0
Magic Kingdom,MetAlmighty Review,Power Metal,3.0
Aggressive Perfector,Havoc at the Midnight Hour Review,Heavy Metal,3.0
Tygers of Pan Tang,Ritual Review,"Heavy Metal, NWOBHM",3.0
Ragnarok,Non Debellicata Review,Black Metal,3.0
Ade,Rise of the Empire Review,"Death Metal, Technical Death Metal",3.0
Charlene Beretah,Ram Review,"Post-Metal, Sludge",3.0
Bölzer,Lese Majesty Review,"Blackened Death Metal, Progressive Metal",3.0
Casket Huffer,Filth Ouroboros Review,"Black Metal, Death Metal",3.0
Terminus,A Single Point of Light Review,Heavy Metal,3.0
Bask,III Review,"Folk, Hard Rock, Psychedelic Rock, Stoner Rock",3.0
GoatHawkBuffalo,Come to Temple Review,,3.0
Nocturnalia,III Winter Review,"Dark Rock, Folk",3.0
Hour of Penance,Misotheism,"Death Metal, Technical Death Metal",3.0
Nevaria,Finally Free Review,,3.0
Purulent Necrosis,Cadaverized Humanity Review,Death Metal,3.0
Orodruin,Ruins of Eternity Review,"Doom Metal, NWOBHM",3.0
Dissorted,The Final Divide Review,Thrash Metal,3.0
Angel Witch,Angel of Light Review,"Heavy Metal, NWOBHM",3.0
Nile,Vile Nilotic Rites Review,"Death Metal, Technical Death Metal",3.0
Paganizer,The Tower of the Morbid Review,Death Metal,3.0
Voyager,Colours in the Sun Review,Progressive Metal,3.0
Rank and Vile,redistribution of flesh. Review,"Death Metal, Powerviolence",3.0
Novembers Doom,Nephilim Grove Review,"Death Metal, Doom Metal",3.0
Timelost,Don’t Remember Me for This Review,"Not Metal, Shoegaze",3.0
Vastum,Orificial Purge Review,Death Metal,3.0
Ethereal Kingdoms,Hollow Mirror Review,Symphonic Metal,3.0
Aegrus,In Manus Satanas Review,Black Metal,3.0
Negator,Vnitas Pvritas Existentia Review,Black Metal,3.0
1349,The Infernal Pathway Review,Black Metal,3.0
War Cloud,State of Shock Review,"Heavy Metal, Thrash Metal",3.0
Screamer,Highway of Heroes Review,Heavy Metal,3.0
Voice of Ruin,Acheron Review,Melodic Death Metal,3.0
Gentihaa,Reverse Entropy Review,"Power Metal, Symphonic Metal",3.0
Shade of Hatred,Reflection on Ruin Review,"Death Metal, Melodic Death Metal",3.0
Torpor,Rhetoric of the Image Review,"Doom Metal, Experimental Metal, Noise, Post-Metal, Sludge",3.0
Toxic Holocaust,Primal Future: 2019 Review,Thrash Metal,3.0
Astrosaur,Obscuroscope Review,Post-Metal,3.0
Iron Kingdom,On the Hunt Review,Heavy Metal,3.0
Monolord,No Comfort Review,"Doom Metal, Stoner Metal",3.0
Entrail,Eater of Starlight Review,,3.0
