Band,Album,Genres,Score
Eye of Nix,Ligeia Review,"Black Metal, Doom Metal",2.5
Kryptograf,Kryptograf Review,,2.5
Acârash,Descend to Purity Review,"Black Metal, Gothic Metal, Hard Rock",2.5
Sarpa,Solivagus Review,Black Metal,2.5
Death Courier,Necrotic Verses Review,Death Metal,2.5
Hexenbrett,Zweite Beschwörung: Ein Kind zu töten Review,"Black Metal, Heavy Metal, Melodic Black Metal, Punk",2.5
Paralysis,Mob Justice Review,"Hardcore, Thrash Metal",2.5
Ashtar,Kaikuja Review,"Doom Metal, Sludge Metal",2.5
Fairyland,Osyrhianta Review,"Power Metal, Symphonic Metal",2.5
Wolves Den,Miserere Review,"Black Metal, Blackened Death Metal, Melodic Black Metal",2.5
Heron,Time Immemorial Review,Sludge,2.5
Old Corpse Road,On Ghastly Shores Lays the Wreckage of Our Lore Review,Black Metal,2.5
Golden Ashes,In the Lugubrious Silence of Eternal Night Review,"Ambient, Atmospheric Black Metal",2.5
Sinisthra,The Broad and Beaten Way Review,"Gothic Metal, Heavy Metal",2.5
Funeralopolis,…of Deceit and Utter Madness Review,Death Metal,2.5
Æther Realm,Redneck Vikings from Hell Review,Melodic Death Metal,2.5
Vader,Solitude in Madness Review,"Death Metal, Thrash Metal",2.5
Witchcraft,Black Metal Review,"Black Metal, Not Metal",2.5
Unmerciful,Wrath Encompassed Review,Death Metal,2.5
An Autumn for Crippled Children,"All Fell Silent, Everything Went Quiet Review","Black Metal, Post-Metal",2.5
Katatonia,City Burials Review,Post-Metal,2.5
Funeral Leech,Death Meditation Review,"Death Metal, Doom Metal",2.5
Ols,Widma Review,Dark Neofolk,2.5
Oranssi Pazuzu,Mestarin kynsi Review,,2.5
Dool,Summerland Review,Dark Rock,2.5
Witches of Doom,Funeral Radio Review,,2.5
Drakonis,Blessed by Embers Review,Black Metal,2.5
Rämlord,From Dark Waters Review,Heavy Metal,2.5
Twitch of the Death Nerve,A Resting Place for the Wrathful Review,Death Metal,2.5
Dodenbezweerder,Vrees De Toorn Van De Wezens Verscholen Achter Majestueuze Vleugels Review,"Black Metal, Noise",2.5
Ani Lo. Projekt,A Time Called Forever Review,"Power Metal, Progressive Metal, Symphonic Metal",2.5
Aronious,Perspicacity Review,"Death Metal, Progressive Metal, Technical Death Metal",2.5
Hemotoxin,Restructure the Molded Mind Review,"Death Metal, Thrash Metal",2.5
Ghost Toast,Shape Without Form Review,"Instrumental Metal, Progressive Metal",2.5
Badd Kharma,On Fire Review,"Hard Rock, Heavy Metal",2.5
Rotting Kingdom,A Deeper Shade of Sorrow Review,"Death Metal, Doom Metal",2.5
Wolf,Feeding the Machine Review,Heavy Metal,2.5
Fós,Rinne mé iarraidh Review,,2.5
Sicarius,God of Dead Roots Review,Black Metal,2.5
Last Call at Nightowls,Ask the Dust Review,Doom Jazz,2.5
The Motion Mosaic,Avant-Garbage Review,"Hardcore, Mathcore, Metalcore",2.5
Karg,Traktat Review,"Atmospheric Black Metal, Black Metal",2.5
Demons & Wizards,III Review,Power Metal,2.5
Aktor,Placebo Review,"Hard Rock, Heavy Metal",2.5
Stallion,Slaves of Time Review,"Heavy Metal, Speed Metal, Thrash Metal",2.5
Treurwilg,An End to Rumination Review,"Doom Metal, Funeral Doom, Post-Metal",2.5
Sortout,Conquer From Within Review,Metalcore,2.5
Necrobode,Sob o Feitiço do Necrobode Review,"Black Metal, Death Metal",2.5
Turia,Degen van Licht Review,"Atmospheric Black Metal, Black Metal",2.5
Ravenword,Transcendence Review,,2.5
God Dethroned,Illuminati Review,"Death Metal, Melodic Death Metal",2.5
Sycomore,Bloodstone Review,Sludge,2.5
Nattverd,Styggdom Review,Black Metal,2.5
Giobia,Plasmatic Idol Review,,2.5
Satan Worship,Teufelssprache Review,"Black Metal, Thrash Metal",2.5
Svart Crown,Wolves Among the Ashes Review,"Black Metal, Blackened Death Metal, Death Metal",2.5
Unzucht,Jenseits der Welt Review,"Alternative Metal, Industrial Metal",2.5
Lordi,Killection (A Fictional Compilation Album) Review,"Hard Rock, Heavy Metal",2.5
Big Scenic Nowhere,Vision Beyond Horizon Review,"Psychedelic Rock, Stoner Metal, Stoner Rock",2.5
Folian,Blue Mirror Review,"Drone, Noise, Post-Metal, Shoegaze",2.5
Mavorim,Axis Mundi Review,Black Metal,2.5
Corrective Measures: Blind Guardian Twilight Orchestral,Legacy of the Dark Lands,"Power Metal, Symphonic Metal",2.5
Ereley,Diablerie Review,"Industrial Metal, Progressive Metal, Progressive Rock",2.5
Nero Di Marte,Immoto Review,"Post-Metal, Progressive Metal",2.5
Hazzerd,Delirium Review,,2.5
Defiled,Infinite Regress Review,Death Metal,2.5
Annihilator,"Ballistic, Sadistic Review",Thrash Metal,2.5
Dominia,The Withering of the Rose Review,"Doom Metal, Gothic Metal",2.5
Acid Mammoth,Under Acid Hoof Review,Doom Metal,2.5
Svarttjern,Shame Is Just a Word Review,"Black Metal, Thrash Metal",2.5
The Osedax,Meridians Review,"Doom Metal, Sludge Metal",2.5
Ryte,Ryte Review,Doom Metal,2.5
Horned Almighty,To Fathom the Master’s Grand Design Review,Black Metal,2.5
Sons of Apollo,MMXX Review,Progressive Metal,2.5
Bonded,Rest in Violence Review,"Groove Metal, Thrash Metal",2.5
Odious Mortem,Synesthesia Review,"Death Metal, Technical Death Metal",2.5
Oberst,Paradise Review,"Hardcore, Metalcore, Post-Hardcore, Post-Metal, Progressive Metal",2.5
Kaoteon,Kaoteon Review,Death Metal,2.5
Erdling,Yggdrasil Review,Electronic Metal,2.5
Empire of the Moon,Εκλειψις Review,"Atmospheric Black Metal, Black Metal, Melodic Black Metal",2.5
Tylor Dory Trio,Unsought Salvation Review,Progressive Metal,2.5
Joel Fausto & Illusion Orchestra,Inside the Throat of a Giant Insect Review,,2.5
The Drift,Seer Review,"Groove Metal, Post-Metal, Sludge Metal",2.5
Hypno5e,A Distant (Dark) Source Review,"Post-Metal, Progressive Metal",2.5
Cattle Decapitation,Death Atlas Review,"Black Metal, Death Metal, Melodic Black Metal",2.5
Avslut,Tyranni Review,Black Metal,2.5
Vesperith,Vesperith Review,,2.5
Morgan Rider and the Deep Dark River,Leviathan and the Deep Dark Blue Review,"Folk, Folk Metal, Rock",2.5
Mortuary,The Autophagous Reign Review,"Death Metal, Thrash Metal",2.5
Serpens Luminis,Bright Euphoria Review,"Black Metal, Death Metal",2.5
PH,Osiris Hayden Review,"Drone, Industrial Metal, Psychedelic Rock, Stoner Rock",2.5
The Deathtrip,Demon Solar Totem Review,Black Metal,2.5
Apotheus,The Far Star Review,"Melodic Death Metal, Progressive Metal",2.5
Vultur,Drowned in Gangrenous Blood Review,"Death Doom, Death Metal",2.5
Cannabis Corpse,Nug So Vile Review,Death Metal,2.5
Necronomicon,Unus Review,"Black Metal, Death Metal, Symphonic Metal",2.5
Rexoria,Ice Breaker Review,"Heavy Metal, Power Metal",2.5
Telepath,Mental Mutations Review,"Progressive Metal, Progressive Rock, Psychedelic Rock",2.5
Shadow Limb,Burn Scar Review,"Groove Metal, Progressive Metal, Sludge Metal",2.5
Ogre,Thrice as Strong Review,"Doom Metal, Heavy Metal",2.5
Cloak,The Burning Dawn Review,"Black Metal, Melodic Black Metal, Rock",2.5
Savage Master,"Myth, Magic & Steel Review",Heavy Metal,2.5
Cathubodua,Continuum Review,"Power Metal, Symphonic Metal",2.5
Black Mastiff,Loser Delusions Review,"Stoner Metal, Stoner Rock",2.5
Shrine of Insanabilis,Vast Vortex Litanies Review,Black Metal,2.5
Merda Mundi,Hatred Review,Black Metal,2.5
Juggernaut,Neuroteque Review,"Drone, Folk, Sludge Metal",2.5
Arx Atrata,The Path Untravelled Review,Atmospheric Black Metal,2.5
Alunah,Violet Hour Review,"Doom Metal, Heavy Metal",2.5
Grim Reaper,At the Gates Review,"Heavy Metal, NWOBHM",2.5
Opium Lord,Vore Review,Sludge,2.5
Profetus,The Sadness of Time Passing Review,"Death Doom, Death Metal, Doom Metal, Funeral Doom",2.5
Advent Sorrow,Kali Yuga Crown Review,Black Metal,2.5
Bones,Diseased Review,Death Metal,2.5
Gemini One,Per Aspera EP Review,Doom Metal,2.5
Vitriol,To Bathe from the Throat of Cowardice Review,"Blackened Death Metal, Technical Death Metal",2.5
Ereb Altor,Järtecken Review,"Black Metal, Viking Metal",2.5
Weltfremd,Nachwelt Review,"Black Metal, Doom Metal",2.5
Cognizance,Malignant Dominion Review,"Death Metal, Deathcore, Melodic Death Metal, Technical Death Metal",2.5
Void King,Barren Dominion Review,"Drone, Sludge",2.5
Mike Patton and Jean-Claude Vannier,Corpse Flower Review,Not Metal,2.5
V,Led into Exile Review,"Doom Metal, Post-Metal, Sludge",2.5
Soul of Anubis,The Last Journey,"Hardcore, Sludge",2.5
Ledge,All I Hope For Review,"Hardcore, Powerviolence, Sludge",2.5
Pandemonium,Monuments of Tragedy Review,Melodic Death Metal,2.5
Amanita Virosa,Original Plague Review,Melodic Death Metal,2.5
Gorilla Wizard,Tales From the Cauldron Review,"Sludge Metal, Stoner Metal",2.5
Domination Inc.,Memoir 414 Review,"Groove Metal, Thrash Metal",2.5
Antichrist Siege Machine,Schism Perpetration Review,"Black Metal, Death Metal",2.5
Crobot,Motherbrain Review,Heavy Metal,2.5
Cerebral Rot,Odious Descent Into Decay Review,Death Metal,2.5
Repent,Condemned to Fail Review,Thrash Metal,2.5
NorthTale,Welcome to Paradise Review,Power Metal,2.5
Destruction,Born to Perish Review,Thrash Metal,2.5
Strappado,Exigit Sincerae Devotionia Affectus Review,"Death Metal, Slam",2.5
Cruickshank,Cruickshank Review,"Hardcore, Sludge",2.5
Turret,In the Shadows Review,Heavy Metal,2.5
Excuse,Prophets from the Occultic Cosmos Review,Thrash Metal,2.5
Total Hate,Throne Behind a Black Veil Review,"Black Metal, Industrial Metal, Punk",2.5
Swarn,Black Flame Order Review,Death Metal,2.5
Cable,Take the Stairs to Hell Review,"Hard Rock, Sludge",2.5
Thy Art Is Murder,Human Target Review,Deathcore,2.5
Hatriot,From Days Unto Darkness Review,Thrash Metal,2.5
Rotten Hate,Stabbing the Masses Review,"Crust Punk, Death Metal",2.5
Clouds Collide,They Don’t Sleep Anymore,Post-Metal,2.5
As I May,My Own Creation Review,Metalcore,2.5
Black Passage,The Veil Review,"Deathcore, Melodic Metal, Metalcore",2.5
Freternia,The Gathering Review,Power Metal,2.5
Suicide Forest,Suicide Forest Review,"Atmospheric Black Metal, Black Metal",2.5
Hex,God Has No Name Review,"Death Metal, Doom Metal",2.5
Drimys Winteri,Excelsa Natura Review,,2.5
Valaraukar,Demonian Abyssal Visions Review,Black Metal,2.5
Mysticism Black,Return of the Bestial Flame Review,Black Metal,2.5
Lifes,Treading Water Review,"Grind, Hardcore, Noise, Powerviolence",2.5
Anthrocene,Nucleation Review,"Metalcore, Power Metal",2.5
Mirror,Pyramid of Terror Review,Heavy Metal,2.5
Those Darn Gnomes,Calling Whitetails to a Tuned Bow Review,"Avant-Garde, Death Metal, Noise, Non-metal Metal Things, Progressive Metal",2.5
Lyken21,Cyclical Insight Review,Heavy Metal,2.5
Tar Pit,Tomb of Doom Review,Sludge,2.5
Intothecrypt,Vakor Review,"Blackened Death Metal, Doom Metal",2.5
Critical Mess,Man Made Machine Made Man Review,Death Metal,2.5
Moonlight Haze,De Rerum Natura Review,"Power Metal, Symphonic Metal",2.5
Power from Hell,Profound Evil Presence Review,Black Metal,2.5
Hidden Lapse,Butterflies Review,"Progressive Metal, Symphonic Metal",2.5
Sandness,Untamed Review,"Cock Rock, Hair Metal, Hard Rock",2.5
Ravensire,A Stone Engraved in Red Review,"Epic Metal, Heavy Metal",2.5
Epectase,Astres Review,Black Metal,2.5
Pinkish Black,Concept Unification Review,"Doom Metal, Psychedelic Rock",2.5
Beheaded,Only Death Can Save You Review,Death Metal,2.5
The Lord Weird Slough Feg,New Organon Review,Heavy Metal,2.5
Morass of Molasses,The Ties That Bind Review,"Progressive Rock, Sludge Metal, Stoner Metal",2.5
Irata,Tower Review,"Post-Metal, Progressive Rock, Sludge Metal",2.5
Firespawn,Abominate Review,Death Metal,2.5
Third Wave,Metamorphosis Review,"Djent, Metalcore, Progressive Metal",2.5
The Lumberjack Feedback,Mere Mortals Review,"Doom Metal, Instrumental Metal, Post-Metal",2.5
Psychotool,Rotten Paradise Review,Melodic Death Metal,2.5
Gaahls WYRD,GastiR – Ghosts Invited Review,,2.5
Leathürbitch,Into the Night Review,"Heavy Metal, Speed Metal",2.5
Worshipper,Light in the Wire Review,"Stoner Metal, Stoner Rock",2.5
Thonian Horde,Downfall Review,Black Metal,2.5
Valborg,Zentrum Review,"Death Doom, Doom Metal",2.5
Dreadnought,Emergence Review,"Doom Metal, Post-Metal",2.5
Bright Curse,Time of the Healer Review,"Progressive Rock, Psychedelic Rock, Stoner Metal",2.5
Disparager,Existential Dread Review,Metalcore,2.5
Mental Cruelty,Inferis Review,"Death Metal, Deathcore, Slam",2.5
Call of the Void,Buried in Light Review,Hardcore,2.5
Body Harvest,Parasitic Slavery Review,Death Metal,2.5
Eye of the Destroyer,Baptized in Pain Review,,2.5
Sol Sistere,Cold Extinguished Light Review,"Atmospheric Black Metal, Black Metal",2.5
Osiah,Kingdom of Lies Review,"Death Metal, Deathcore",2.5
Inanimate Existence,Clockwork Review,"Death Metal, Technical Death Metal",2.5
Ruff Majik,Tårn Review,Doom Metal,2.5
Sunn O))),Life Metal Review,,2.5
Hedonihil,I Review,"Black Metal, Death Metal",2.5
Sinnrs,Profound Review,"Black Metal, Death Metal, Symphonic Metal",2.5
Oceanwake,Lights Flashing in Mute Scenery,"Doom Metal, Post-Metal",2.5
Steel Prophet,The God Machine Review,Heavy Metal,2.5
Ketos,First Strike Review,Metalcore,2.5
Enforcer,Zenith Review,"Heavy Metal, Speed Metal",2.5
Cosmic Putrefaction,At the Threshold of the Greatest Chasm Review,Death Metal,2.5
Totengott,The Abyss Review,"Black Metal, Doom Metal, Thrash Metal",2.5
Grand Magus,Wolf God Review,Heavy Metal,2.5
Allegaeon,Apoptosis Review,"Melodic Death Metal, Technical Death Metal",2.5
Necromutilator,Black Blood Aggression Review,"Black Metal, Blackened Death Metal, Death Metal",2.5
Raketkanon,RKTKN#3 Review,"Alt-Metal, Alternative Metal, Experimental Metal",2.5
Cracked Machine,The Call of the Void Review,Psychedelic Rock,2.5
Corrosive,Nourished by Blood Review,Death Metal,2.5
Ellende,Lebensnehmer Review,"Atmospheric Black Metal, Black Metal",2.5
Illimitable Dolor,Leaden Light Review,"Death Metal, Doom Metal",2.5
Frosthelm,Pyrrhic Review,"Black Metal, Thrash Metal",2.5
Eluveitie,Ategnatos Review,"Folk Metal, Melodic Death Metal",2.5
Tel,Lowlife Review,"Doom Metal, Progressive Metal, Sludge",2.5
West of Hell,Blood of the Infidel Review,"Heavy Metal, Thrash Metal",2.5
Earth Messiah,Ouroboros Review,Stoner Metal,2.5
Magic Circle,Departed Souls Review,"Doom Metal, Occult Rock",2.5
Imprecation,Damnatio Ad Bestias Review,Death Metal,2.5
Usurper,Lords of the Permafrost Review,"Black Metal, Death Metal, Thrash Metal",2.5
Truth Corroded,Bloodlands Review,"Death Metal, Metalcore",2.5
Grave Violator,Back to the Cult Review,"Black Metal, Thrash Metal",2.5
Battle Beast,No More Hollywood Endings Review,Heavy Metal,2.5
Tempel,Tempel Review,"Hard Rock, Hardcore, Heavy Metal",2.5
Superlynx,New Moon Review,"Doom Metal, Occult Rock",2.5
Deafkids,Metaprogramação Review,"Experimental Metal, Industrial Metal, Noise, Non-metal Metal Things, Punk",2.5
Skeletoon,They Never Say Die Review,Power Metal,2.5
Meadows End,The Grand Antiquation Review,"Death Metal, Melodic Death Metal, Symphonic Metal",2.5
Sacred Monster,Worship the Weird Review,"Doom Metal, Heavy Metal",2.5
Kings Destroy,Fantasma Nera Review,"Doom Metal, Hard Rock",2.5
Black Lung,Ancients Review,"Doom Metal, Stoner Metal",2.5
Dying Embers,Where Shadeless Dwell Frozen Review,"Gothic Metal, Melodic Death Metal, Power Metal",2.5
Dronte,Quelque Part Entre La Guerre Et La Lâcheté Review,Noise Rock,2.5
Pounder,Uncivilized Review,NWOBHM,2.5
Queensrÿche,The Verdict Review,"Heavy Metal, Progressive Metal",2.5
Joyless Euphoria,Dreaming in Ultraviolet Review,"Black Metal, Shoegaze",2.5
Continuum,Designed Obsolescence Review,Technical Death Metal,2.5
Candlemass,The Door to Doom Review,Doom Metal,2.5
Dead Witches,The Final Exorcism Review,"Doom Metal, Stoner Metal",2.5
Kaleikr,Heart of Lead Review,"Death Metal, Post-Metal",2.5
Overkill,The Wings of War Review,Thrash Metal,2.5
The Wandering Ascetic,Crimson Review,"Hard Rock, Heavy Metal",2.5
Necrutero,Metallo Review,"Death Metal, Thrash Metal",2.5
Varego,I Prophetic Review,"Progressive Metal, Sludge",2.5
Laceration,Remnants Review,"Death Metal, Thrash Metal",2.5
Herod,Sombre Dessein Review,"Death Metal, Progressive Metal, Sludge Metal",2.5
10:13,Result of an Iron Age Review,"Black Metal, Progressive Metal",2.5
Desecravity,Anathema Review,"Death Metal, Technical Death Metal",2.5
The Ghost Next Door,A Feast for the Sixth Sense Review,"Doom Metal, Progressive Metal, Stoner Metal",2.5
Yerûšelem,The Sublime Review,Industrial Metal,2.5
Zohamah,Spread My Ashes Review,"Black Metal, Death Metal, Doom Metal",2.5
Astronoid,Astronoid Review,"Progressive Metal, Shoegaze",2.5
Hecate Enthroned,Embrace of the Godless Aeon Review,"Black Metal, Death Metal",2.5
A Secret Revealed,Sacrifices Review,"Metalcore, Post-Hardcore, Post-Metal",2.5
Fusion Bomb,Concrete Jungle Review,Thrash Metal,2.5
Mortal Scepter,Where Light Suffocates Review,"Death Metal, Thrash Metal",2.5
Imha Tarikat,Kara Ihlas Review,Black Metal,2.5
Malevolent Creation,The 13th Beast Review,Death Metal,2.5
Noctambulist,Atmospheres of Desolation Review,"Death Metal, Technical Death Metal",2.5
Soilwork,Verkligheten Review,Melodic Death Metal,2.5
Bloody Times,On a Mission Review,Heavy Metal,2.5
Yatra,Death Ritual Review,"Doom Metal, Stoner Metal",2.5
Sönambula,Bicéfalo Review,"Death Metal, Doom Metal, Sludge Metal",2.5
Meathook,"Crypts, Coffins, Corpses Review",Death Metal,2.5
Sons of Lazareth,Blue Skies Back to Gray Review,"Stoner Metal, Stoner Rock",2.5
Juniper Grave,Of Hellions and Harridans Review,Stoner Rock,2.5
Goathammer,Ceremony of Morbid Destruction Review,"Black Metal, Death Metal",2.5
Ichor,Hadal Ascending Review,"Blackened Death Metal, Death Metal",2.5
Sinbreed,IV Review,Power Metal,2.5
Bast,Nanoångström Review,"Black Metal, Doom Metal",2.5
Nature Morte,NM1 Review,,2.5
Supreme Havoc,One and All Review,"Doom Metal, Punk, Sludge Metal",2.5
Loimann,A Voluntary Lack of Wisdom Review,Stoner Metal,2.5
Revolutio,Vagrant Review,"Alt-Metal, Groove Metal, Thrash Metal",2.5
Malphas,The 39th Spirit Review,Melodic Death Metal,2.5
Paragon Impure,Sade Review,Black Metal,2.5
Glacial Tomb,Glacial Tomb Review,"Black Metal, Death Metal",2.5
Praying Angel,The Judgement Review,Deathcore,2.5
Megaton Leviathan,Mage Review,"Ambient Metal, Doom Metal, Drone, Shoegaze",2.5
Terrorizer,Caustic Attack Review,Death Metal,2.5
Outlaw,Marauders Review,Heavy Metal,2.5
HateSphere,Reduced to Flesh Review,"Groove Metal, Thrash Metal",2.5
Drowning in You,Here Is Hope Review,"Hardcore, Metalcore",2.5
Deadbird,III: The Forest Within The Tree Review,"Doom Metal, Sludge Metal",2.5
Drift into Black,Dead Suns Under the Forever Moon Review,Doom Metal,2.5
Uncle Acid and the Deadbeats,Wasteland Review,Stoner Rock,2.5
Ultha,The Inextricable Wandering Review,Black Metal,2.5
Lucifericon,Al-Khem-Me Review,"Black Metal, Death Metal",2.5
Orkan,Element Review,Black Metal,2.5
Binah,Phobiate Review,"Death Metal, Progressive Death",2.5
Hypnos,Set Fire to the Sky Review,"Hard Rock, Heavy Metal, Retro Metal",2.5
Anaal Nathrakh,A New Kind of Horror Review,"Black Metal, Industrial Metal",2.5
Revocation,The Outer Ones Review,"Death Metal, Progressive Metal, Technical Death Metal, Thrash Metal",2.5
Black Majesty,Children of the Abyss Review,"Heavy Metal, Power Metal",2.5
Gnosis,The Offering of Seven Review,Black Metal,2.5
Crippled Black Phoenix,Great Escape Review,"Ambient Metal, Doom Metal, Progressive Rock",2.5
Krisiun,Scourge of the Enthroned Review,Death Metal,2.5
P.H.O.B.O.S.,Phlogiston Catharsis Review,"Black Metal, Doom Metal, Industrial Metal",2.5
Farooq,Heat Review,"Metalcore, Nu Metal",2.5
Helion Prime,Terror of the Cybernetic Space Monster Review,Power Metal,2.5
Descent,Towers of Grandiosity Review,"Black Metal, Death Metal",2.5
U.D.O.,Steelfactory Review,Heavy Metal,2.5
Tornado,Commitment to Excellence Review,Thrash Metal,2.5
Spacetrucker,Smooth Orbit Review,Stoner Metal,2.5
Exocrine,Molten Giant Review,Death Metal,2.5
A Dying Planet,Facing the Incurable Review,Progressive Metal,2.5
Essenz,Manes Impetus Review,"Black Metal, Doom Metal",2.5
Halcyon Way,Bloody But Unbowed Review,"Power Metal, Progressive Metal, Thrash Metal",2.5
Ravens Creed,Get Killed or Try Dying Review,"Crust Punk, Death Metal",2.5
Monster Skull,The Face of the Great Green Devil Review,"Heavy Metal, Progressive Metal",2.5
Motorowl,Atlas Review,"Doom Metal, Hard Rock, Stoner Rock",2.5
Imperial Domain,The Deluge Review,Melodic Death Metal,2.5
Black Space Riders,Amoretum Vol. 2 Review,Psychedelic Rock,2.5
Gravewards,Ruinous Ensoulment Review,Death Metal,2.5
Decline of the I,Escape Review,"Black Metal, Post-Metal",2.5
Spaceslug,Eye the Tide Review,"Doom Metal, Post-Metal, Stoner Metal",2.5
Elvenstorm,The Conjuring Review,"Heavy Metal, Power Metal",2.5
Goat Explosion,Rumors of Man Review,"Doom Metal, Stoner Metal",2.5
Survival,Murkin Hella Fools Review,"Nu Metal, Thrash Metal",2.5
Cemetery Lust,Rotting in Piss Review,"Black Metal, Thrash Metal",2.5
Firtan,Okeanos Review,Black Metal,2.5
Sathanas,Necrohymns Review,"Black Metal, Death Metal, Thrash Metal",2.5
Iron Hunter,Mankind Resistance Review,Heavy Metal,2.5
Bookakee,Ignominies Review,Technical Death Metal,2.5
The Sea Within,The Sea Within Review,Progressive Rock,2.5
Morgengrau,Blood Oracle Review,Death Metal,2.5
Ghostbound,All is Phantom Review,Black Metal,2.5
Haunted,Dayburner Review,"Doom Metal, Sludge Metal",2.5
Gutter Instinct,Heirs of Sisyphus Review,"Black Metal, Death Metal",2.5
Abstracter,Cinereous Incarnate Review,"Black Metal, Doom Metal",2.5
Acârash,In Chaos Becrowned Review,"Black Metal, Occult Rock",2.5
Abhor,Occulta Religio Review,Black Metal,2.5
Lizzy Borden,My Midnight Things Review,Heavy Metal,2.5
Sadistik Forest,Morbid Majesties Review,Death Metal,2.5
Spock’s Beard,Noise Floor Review,Progressive Rock,2.5
Lordi,Sexorcism Review,"Hard Rock, Heavy Metal",2.5
Mist,Free Me of the Sun Review,Doom Metal,2.5
Aborted Fetus,The Ancient Spirits of Decay Review,"Death Metal, Slam",2.5
Uada,Cult of a Dying Sun Review,"Black Metal, Melodic Black Metal",2.5
Necros Christos,Domedon Doxomedon Review,Death Metal,2.5
Monument,Hellhound Review,Heavy Metal,2.5
Nekrogoblikon,Welcome to Bonkers Review,Melodic Death Metal,2.5
Fractal Gates,The Light That Shines Review,"Melodic Death Metal, Space Metal",2.5
The Ever Living,Herephemine Review,"Ambient Metal, Post-Metal",2.5
Tomorrow’s Eve,Mirror of Creation III – Project Ikaros Review,Progressive Metal,2.5
Thy Catafalque,Geometria Review,Black Metal,2.5
Blood Tsunami,Grave Condition Review,"Black Metal, Thrash Metal",2.5
Celtachor,Fiannaíocht Review,"Black Metal, Folk Metal",2.5
Grave Upheaval,Untitled Review,"Black Metal, Death Metal, Doom Metal",2.5
The Dali Thundering Concept,Savages Review,"Deathcore, Djent, Mathcore, Progressive Metal",2.5
Speedclaw,Beast in the Mist,"Heavy Metal, Speed Metal, Thrash Metal",2.5
Ols,Mszarna Review,Folk,2.5
Vorbid,Mind Review,Thrash Metal,2.5
Karma Violens,Serpent God Review,"Blackened Death Metal, Death Metal",2.5
Autokrator,Hammer of the Heretics Review,"Death Metal, Drone",2.5
Škan,Death Crown Review,,2.5
Glorior Belli,The Apostates Review,"Black Metal, Sludge",2.5
Crematory,Oblivion Review,"Death Metal, Industrial Metal",2.5
Abinchova,Weltenwanderer Review,Melodic Death Metal,2.5
Evil Drive,Ragemaker Review,"Melodic Death Metal, Thrash Metal",2.5
Shadowkeep,Shadowkeep Review,Power Metal,2.5
Fátima,Moaner Review,Doom Metal,2.5
Coilguns,Millennials Review,Metalcore,2.5
JIRM,Surge Ex Monumentis Review,"Progressive Metal, Psychedelic Rock, Stoner Rock",2.5
The Golden Grass,Absolutely Review,"Hard Rock, Psychedelic Rock",2.5
Foul Body Autopsy,This Machine Kills Zombies Review,"Death Metal, Melodic Death Metal",2.5
Infraktor,Exhaust Review,Thrash Metal,2.5
Repulsione,Desecrating Review,,2.5
Battlesoul,Sunward and Starward Review,"Folk Metal, Melodic Death Metal",2.5
Nest,Metempsychosis Review,"Black Metal, Sludge Metal",2.5
Insect Ark,Marrow Hymns Review,Drone,2.5
Mad Hatter,Mad Hatter Review,Power Metal,2.5
Demonomancy,Poisoned Atonement Review,"Blackened Death Metal, Speed Metal",2.5
Global Scum,Hell is Home Review,Groove Metal,2.5
Armored Dawn,Barbarians in Black Review,"Heavy Metal, Power Metal",2.5
Blackwülf,Sinister Sides Review,Stoner Metal,2.5
Coffin Torture,Dismal Planet Review,"Doom Metal, Sludge",2.5
Ektomorf,Fury Review,Groove Metal,2.5
Spite,Antimoshiach Review,Black Metal,2.5
The Bad Larrys,Hodads Review,"Hard Rock, Psychedelic Rock, Stoner Rock",2.5
Accuser,The Mastery Review,"Groove Metal, Thrash Metal",2.5
Random Eyes,Grieve No More Review,Heavy Metal,2.5
Rise of Avernus,Eigengrau Review,Symphonic Metal,2.5
Sonic Prophecy,Savage Gods Review,"Heavy Metal, Power Metal",2.5
Bleeding Gods,Dodekathlon Review,,2.5
Anvil,Pounding the Pavement Review,Heavy Metal,2.5
Frost Giant,The Harlot Star Review,"Black Metal, Folk Metal",2.5
Leaves’ Eyes,Sign of the Dragonhead Review,Symphonic Metal,2.5
Oblivion,The Path Towards… Review,"Death Metal, Technical Death Metal",2.5
The Modern Age Slavery,Stygian Review,Death Metal,2.5
Cloak,To Venomous Depths Review,Black Metal,2.5
Ketha,Zero Hours Starlight Review,Djent,2.5
Auðn,Farvegir Fyrndar Review,Black Metal,2.5
Threat Signal,Disconnect Review,"Groove Metal, Metalcore",2.5
Witchery,I Am Legion Review,"Black Metal, Thrash Metal",2.5
Tetragrammacide,Primal Incinerators of Moral Matrix Review,"Death Metal, Doom Metal",2.5
Thy Serpent’s Cult,Supremacy of Chaos Review,Death Metal,2.5
Stahlsarg,Mechanisms of Misanthropy Review,Black Metal,2.5
Forgotten Tomb,We Owe You Nothing Review,Sludge,2.5
Siinai,Sykli Review,"Ambient Metal, Instrumental Metal, Non-metal Metal Things",2.5
Night Viper,Exterminator Review,"Heavy Metal, Thrash Metal",2.5
GWAR,The Blood of Gods Review,Heavy Metal,2.5
Within Silence,Return from the Shadows Review,"Heavy Metal, Power Metal",2.5
Dragonhammer,Obscurity Review,Power Metal,2.5
Spectral Voice,Eroded Corridors of Unbeing Review,Death Metal,2.5
Fozzy,Judas Review,Hard Rock,2.5
Hades Archer,Temple of the Impure Review,"Black Metal, Death Metal",2.5
Wheelfall,The Atrocity Reports Review,Industrial Metal,2.5
Angel Vivaldi,Synapse Review,"Instrumental Metal, Progressive Metal",2.5
Spotlights,Seismic Review,"Post-Metal, Shoegaze, Sludge Metal",2.5
Enzo and the Glory Ensemble,In the Name of the Son Review,"Progressive Metal, Symphonic Metal",2.5
Wolves in the Throne Room,Thrice Woven Review,"Black Metal, Folk Metal",2.5
